Judul;Date;cosine;Kategori;Artikel;Summary;Link
Tragedi keamanan siber dan data pribadi;29 September 2022;0,64724;hacking;DALAM tradisi Yunani klasik, tragedi merupakan perayaan teatrikal warga Athena yang menampilkan cerita-cerita para dewa dan penguasa dengan akhir yang tragis. Aristoteles menyebut tragedi penting bagi masyarakat Athena sebagai katarsis - membangkitkan sensasi ngeri dan sedih, dan pada akhirnya, memberi pelajaran kehidupan bagi pemirsanya. Para aktor lakon tragedi didominasi laki-laki dan, dalam bahasa Yunani, disebut sebagai hypocrites. Peretasan dan pemerintah yang kelabakan Rasa-rasanya, kesemua unsur dalam lakon tragedi Yunani kuno hadir di hadapan publik Indonesia secara banal belakangan ini. Tragedi itu bernama keamanan siber dan data pribadi kita yang hancur lebur dikoyak peretas-peretas (hacker) anonim. Baca juga: Penyelesaian Sengketa dalam UU Perlindungan Data Pribadi Hal itu diikuti rangkaian reaksi dari pemerintah Indonesia yang kelabakan, khususnya jajaran Kementerian Komunikasi dan Informasi (Kemenkominfo) dan Badan Siber dan Sandi Negara (BSSN). Selain saling lempar tanggung jawab, rentetan respons dan statemen yang ditampilkan sejumlah pejabat juga membuat publik semakin miris. Pada minggu ini peretasan terhadap sejumlah jurnalis menjadi tema utama. Bocornya data penduduk Indonesia sebenarnya bukan hal baru, mengingat tahun lalu Nomor Induk Kependudukan (NIK) Presiden Joko Widodo bocor di sejumlah forum internet. Bagi masyarakat umum, peristiwa-peristiwa itu berkesinambungan dengan kontroversi terkait aturan Penyelenggara Sistem Elektronik (PSE) dan rencana penggunaan Domain Names System (DNS) nasional yang dianggap berpotensi membatasi kemerdekaan berekspresi dan demokrasi. Kasus hacker yang menyebut dirinya Bjorka menjadi titik didih kemarahan publik terhadap pemangku kepentingan di bidang komunikasi, informasi, dan keamanan siber. Hingga pada akhirnya Presiden Joko Widodo menyentil jajaran Kemenkominfo dan BSSN. Setelah itu  pemerintah baru memutuskan untuk membentuk tim khusus buat memburu Bjorka. Setelah itu, Rancangan Undang-Undang (RUU) Perlindungan Data Pribadi mendapat booster politik dan proses legislasinya selesai di DPR. Namun, kasus peretasan terhadap jurnalis Narasi kembali membuat publik bertanya-tanya tentang keamanan siber di negeri ini. Bagaimana negara ini memperlakukan keamanan siber dan data pribadi? Pertanyaan yang lebih dalam, keamanan siber untuk siapa? Bisa jadi momentum untuk berbenah Bagi saya, terlepas dari segala kontroversinya, rentetan peristiwa itu sebenarnya merupakan kabar baik bagi keamanan siber di Indonesia. Untuk pertama kalinya, pemerintah dan masyarakat memberi perhatian sangat serius terhadap isu keamanan siber dan perlindungan data pribadi. Meskipun, eskalasi ini harus menunggu para pejabat dan lembaga penting negara diserang dulu oleh Bjorka dan peretas-peretas lain. Selama ini, masyarakat yang lebih sering menjadi korban serangan siber dengan berbagai macam bentuk. Kita bisa bertanya kepada mahasiswa-mahasiswi atau para aktivis lingkungan yang pernah menjadi korban peretasan Whatsapp dan data pribadinya lalu diumbar di internet. Kita juga bisa bertanya kepada para bapak-bapak dan ibu-ibu yang tertekan akibat teror penagih pinjaman online karena data pribadinya bocor. Baca juga: Tafsir UU Perlindungan Data Pribadi yang Perlu Diketahui Demikian juga dengan para jurnalis, tidak hanya dalam kasus jurnalis Narasi, tetapi di daerah-daerah, doxing dan peretasan WhatsApp serta surat elektronik menjadi fenomena rutin, sebagaimana disebut SAFENet. Selama ini para korban serangan siber hanya pasrah data pribadinya diumbar atau dipakai oleh para buzzer dan tukang tagih pinjaman online. Selain tak ada payung hukum yang kuat mengingat lamanya proses legislasi RUU Perlindungan Data Pribadi selama ini, upaya atribusi terhadap pelaku kejahatan dan penyerangan siber juga sulit dilakukan. Kini, yang selama ini dialami para korban serangan siber dialami pula oleh pemerintah. Mulai dari kebingungan hingga kesulitan mengidentifikasi siapa sebenarnya Bjorka, atau siapa peretas para jurnalis. Lebih parah lagi, kita tak pernah benar-benar mengembangkan budaya keamanan siber dan perlindungan data pribadi secara menyeluruh, secara nasional. Ini perlu menjadi momentum penting untuk memikirkan kembali bagaimana kita memahami keamanan siber dan data pribadi. Persoalan keamanan siber dan data pribadi seyogyanya tak dipahami sebagai isu keamanan tradisional yang muara utamanya adalah tentang keamanan negara. Siapapun bisa menjadi korban, baik pejabat, aparat, jurnalis, maupun rakyat. Dalam tradisi kajian keamanan internasional, keamanan siber dipandang sebagai bagian dari keamanan non-tradisional yang meletakkan tidak hanya negara sebagai obyek yang harus dilindungi ketika berbicara mengenai keamanan dan pertahanan. Sifat ruang siber yang difusif dan transnasional membuat ancaman siber dapat menimpa siapa saja. Keamanan siber wajib pula meliputi individu, kelompok masyarakat, dan bahkan nilai dan norma dari suatu negara - semuanya perlu dipandang setara alih-alih negara atau pejabat dilindungi lebih tinggi prioritas keamanan sibernya ketimbang rakyat biasa. Hal ini yang disebut Myriam Dunn Cavelty (2014) tentang bahaya diskursus keamanan siber jika hanya berfokus tunggal pada negara. Jika itu terjadi, negara akan melakukan penguatan keamanan siber dengan mengorbankan keamanan individual. Negara berpotensi akan memprioritaskan pengamanan untuk aparatus dan instrumen kekuasaan alih-alih rakyatnya. Negara, pada akhirnya, dapat menjadi ancaman keamanan siber itu sendiri terhadap warga negaranya. Konsekuensinya, dengan paradigma itu, fokus dan prioritas keamanan dan pengamanan siber menjadi seakan berhenti ketika UU PDP selesai, atau ketika kita tidak mendengar lagi Whatsapp pejabat diretas. Ini tentu saja berbahaya mengingat keamanan siber bukan hanya keamanan negara, tetapi juga keamanan bagi semua. Perlindungan terhadap masyarakat sipil, jurnalis, hingga para mahasiswa yang kritis perlu menjadi perhatian. Penegakan hukum terhadap pelaku kejahatan siber seharusnya tak hanya menunggu apabila pemerintah dan negara menjadi target. Bahkan, apabila serangan siber terjadi pada mereka yang kritis terhadap pemerintah, aparat penegak hukum dan negara tetap perlu memberi perhatian dan perlindungan yang sama. Sebab, pemerintah dapat berganti setiap pemilu lima tahunan, tetapi ancaman keamanan siber tak pernah melihat siapa korban. Semua bisa kena.;DALAM tradisi Yunani klasik, tragedi merupakan perayaan teatrikal warga Athena yang menampilkan cerita-cerita para dewa dan penguasa dengan akhir yang tragis. Peretasan dan pemerintah yang kelabakan Rasa-rasanya, kesemua unsur dalam lakon tragedi Yunani kuno hadir di hadapan publik Indonesia secara banal belakangan ini. Tragedi itu bernama keamanan siber dan data pribadi kita yang hancur lebur dikoyak peretas-peretas (hacker) anonim. Selama ini para korban serangan siber hanya pasrah data pribadinya diumbar atau dipakai oleh para buzzer dan tukang tagih pinjaman online. Selain tak ada payung hukum yang kuat mengingat lamanya proses legislasi RUU Perlindungan Data Pribadi selama ini, upaya atribusi terhadap pelaku kejahatan dan penyerangan siber juga sulit dilakukan.;https://www.kompas.com/tren/read/2022/09/29/111707365/tragedi-keamanan-siber-dan-data-pribadi?page=all
BSSN memburu hacker bjorka;13 September 2022;0,69913;hacking;"Depok- Badan Siber dan Sandi Negara (BSSN) mengusut aksi hacker Bjorka. Mereka mengakui ada kelemahan pada sistem dan faktor manusia di balik kebocoran data. BSSN buka suara terkait rentetan kebocoran data khususnya hacker Bjorka yang menyebarkan data pribadi pejabat pemerintah Indonesia. Sebelumnya, Bjorka menjual data pribadi masyarakat di forum breached.to, seperti data registrasi SIM card prabayar data Komisi Pemilihan Umum (KPU). Data-data sensitif yang dijual itu meliputi nama lengkap, tempat dan tanggal lahir, jenis kelamin, usia, Kartu Tanda Penduduk (KTP), email, nomor ponsel, NIK, nomor KK, operator seluler, hingga tanggal registrasinya. Kepala BSSN Hinsa Siburian mengatakan pihaknya sedang mengusut hacker Bjorka. Siapa Bjorka, apakah ia bekerja sendirian, dari dalam atau luar negeri, hal itu tengah dilacak oleh BSSN. ""Kita sedang telusuri,"" ujar Hinsa di Kantor BSSN, Sawangan, Depok, Jawa Barat, Selasa (13/9/2022). Mengenai sumber data-data yang diklaim hacker Bjorka dapat dari mana, Hinsa tidak menjawab secara lugas. Ia hanya menyebutkan kelemahan atau kerentanan di sistem elektronik hingga mengalami kebocoran data. ""Sumber kelemahan terutama di cyber security itu kelalaian manusia dan juga kerentanan di sistem elektronik yang dimiliki,"" ungkap Hinsa. Diberitakan sebelumnya Presiden Joko Widodo membentuk tim khusus emergency response team ini menyusul sejumlah serangan siber dari hacker Bjorka ke instansi negara dan doxing pejabat pemerintahan. Pembentukan tim dilakukan setelah pemerintah menggelar rapat di Istana Kepresidenan Jakarta. Tim itu akan menindaklanjuti serangan-serangan siber yang diterima beberapa waktu terakhir. ""Perlu ada emergency response team terkait untuk menjaga data, tata kelola data, yang baik di Indonesia dan untuk menjaga kepercayaan publik,"" kata Menteri Komunikasi dan Informatika Johnny G Plate di Istana Kepresidenan Jakarta, Senin (12/9). Johnny menyebut tim tersebut akan terdiri dari Badan Siber dan Sandi Nasional (BSSN), Kominfo, Polri, dan Badan Intelijen Negara (BIN).";"Mereka mengakui ada kelemahan pada sistem dan faktor manusia di balik kebocoran data. Mengenai sumber data-data yang diklaim hacker Bjorka dapat dari mana, Hinsa tidak menjawab secara lugas. Ia hanya menyebutkan kelemahan atau kerentanan di sistem elektronik hingga mengalami kebocoran data. ""Sumber kelemahan terutama di cyber security itu kelalaian manusia dan juga kerentanan di sistem elektronik yang dimiliki,"" ungkap Hinsa. Diberitakan sebelumnya Presiden Joko Widodo membentuk tim khusus emergency response team ini menyusul sejumlah serangan siber dari hacker Bjorka ke instansi negara dan doxing pejabat pemerintahan.";https://inet.detik.com/security/d-6289128/bssn-memburu-hacker-bjorka
Indonesia Masih Jadi Target Utama Serangan Siber;5 October 2022;0,60773;hacking;"Jakarta - Indonesia masih menjadi salah satu target utama serangan cyber. Data dari Badan Siber dan Sandi Negara (BSSN), ada 1,6 miliar serangan siber sepanjang 2021. ""Melihat tingginya jumlah serangan siber di Indonesia, kita perlu memastikan bahwa keamanan infrastruktur kita terjamin dan teruji. Salah satunya bisa dengan menerapkan sistem keamanan terpusat pada infrastruktur jaringan, atau Security Operation Center (SOC), yang bisa meningkatkan visibilitas keamanan di semua perangkat,"" ujar Edwin Lim, Country Director Fortinet Indonesia saat berbicara di R17 Podcast Show Vol.2. Edwin menambahkan peningkatan keahlian SDM menjadi kunci agar bisa mengimbangi kemampuan penjahat siber, serta kemampuan infrastruktur yang tepat. Poin terakhir ini turut diamini Country Sales Director Fujitsu Indonesia Defi Nofitra, menurutnya Infrastruktur yang tepat akan membantu perusahaan atau organisasi mengoptimalkan kemampuan teknologi mereka. ""Setiap perusahaan atau organisasi memiliki kebutuhan teknologi atau digital, dan keamanan yang berbeda. Untuk itu, diperlukan infrastruktur data center yang spesifik untuk memenuhi kebutuhan tersebut,"" ujarnya. Kebutuhan keamanan data center yang andal juga dirasakan oleh Setiaji, Chief Digital Transformation Office, Kementerian Kesehatan Indonesia. Menurutnya salah satu tantangan utama dalam mewujudkan layanan kesehatan terintegrasi adalah bagaimana meyakinkan bahwa aplikasi kesehatan tersebut berikut dengan infrastruktur di dalamnya benar-benar aman dan data yang dimiliki oleh Kementerian Kesehatan hanya digunakan untuk meningkatkan layanan kesehatan bagi masyarakat. ""Untuk mengoptimalkan layanan kesehatan masyarakat, Kementerian Kesehatan telah meluncurkan platform SATUSEHAT yang mengintegrasikan berbagai aplikasi kesehatan mulai dari tingkat paling bawah hingga ke pusat. Tentu diperlukan infrastruktur yang mendukung baik secara operasional maupun keamanan,"" ujarnya. Senada yang disampaikan Noly Hendry, CEO R17 Group. Dia mengatakan Infrastruktur data center yang andal dan aman menjadi sebuah keharusan apabila Indonesia ingin mewujudkan target sebagai kekuatan ekonomi digital di Asia, bahkan dunia. Peningkatan kemampuan baik secara SDM maupun infrastruktur perlu menjadi perhatian para pelaku industri. ""Saat ini kita berada di era digital dengan arus informasi yang sedemikian besar. Tentu dibutuhkan dukungan infrastruktur data center yang kuat untuk mengelola aliran data yang besar ini,"" ujar Noly. ""Dengan infrastruktur Indonesia yang lebih siap, lebih aman, dan kita bisa siap menghadapi pertumbuhan ekonomi digital yang sudah banyak diprediksi oleh berbagai pihak akan terjadi di Indonesia,"" pungkasnya.";"Jakarta - Indonesia masih menjadi salah satu target utama serangan cyber. Data dari Badan Siber dan Sandi Negara (BSSN), ada 1,6 miliar serangan siber sepanjang 2021. ""Melihat tingginya jumlah serangan siber di Indonesia, kita perlu memastikan bahwa keamanan infrastruktur kita terjamin dan teruji. Salah satunya bisa dengan menerapkan sistem keamanan terpusat pada infrastruktur jaringan, atau Security Operation Center (SOC), yang bisa meningkatkan visibilitas keamanan di semua perangkat,"" ujar Edwin Lim, Country Director Fortinet Indonesia saat berbicara di R17 Podcast Show Vol.2. Edwin menambahkan peningkatan keahlian SDM menjadi kunci agar bisa mengimbangi kemampuan penjahat siber, serta kemampuan infrastruktur yang tepat.";https://inet.detik.com/security/d-6330601/indonesia-masih-jadi-target-utama-serangan-cyber
Indonesia Kekurangan Tenaga Ahli Keamanan Siber;1 October 2022;0,59556;hacking;"Jakarta - Salah satu masalah paling mendasar yang saat ini dihadapi oleh transaksi internet/transaksi elektronik adalah masalah keamanan sistem informasi dan perlindungan terhadap data pribadi. Berbagai faktor berkontribusi di dalam besarnya tingkat ketidakpercayaan pengguna internet dalam transaksi e-commerce, salah satu penyebab tertinggi adalah cyber criminal. Berdasarkan data Badan Siber dan Sandi Negara (BSSN), diketahui ada lebih dari 700 juta serangan siber yang terjadi di Indonesia pada tahun 2022. Baru-baru ini juga terjadi kebocoran data registrasi kartu SIM, di samping insiden-insiden besar sebelumnya yang melibatkan data kesehatan e-HAC, data kementerian, BUMN, hingga data pelanggan di e-commerce ternama. Di samping itu, Indonesia juga mengalami kekurangan tenaga ahli keamanan siber. Survei yang dilakukan oleh SecLab BDO Indonesia terhadap talenta TI di Indonesia, mengungkap bahwa 9 dari 10 lulusan teknologi memilih untuk menjadi developer perangkat lunak, dan hanya 1 dari 10 yang berminat untuk mendalami keamanan siber. Kekurangan tenaga ahli ini, dipadukan dengan wawasan masyarakat awam yang rendah mengenai keamanan siber pribadi, membuat Indonesia menjadi sasaran empuk bagi para hacker yang berniat jahat. BDO Indonesia adalah anggota BDO International Limited dan merupakan bagian dari jaringan BDO internasional dari perusahaan anggota independen. SecLab BDO Indonesia, adalah salah satu layanan di BDO Indonesia yang berfokus pada bidang keamanan siber dan forensik digital di Indonesia. Dalam membangun talenta tenaga ahli keamanan siber, SecLab BDO Indonesia melakukan pelatihan, seminar, dan juga program kolaborasi, contohnya Wreck It, sebuah kompetisi hacking kasus-kasus keamanan yang real, berkolaborasi dengan BSSN, dengan tujuan untuk mencari bakat-bakat baru dalam bidang keamanan digital. ""Banyak organisasi yang tidak paham dan akhirnya menomorduakan cybersecurity. Sekarang sudah saatnya kita berbenah keamanan siber. SecLab BDO Indonesia hendak membuka pintu lebih luas untuk kolaborasi dan menghimbau pihak-pihak yang berwenang untuk merangkul dan bekerjasama dengan para pakar dalam mengatasi permasalahan keamanan digital,"" jelas Harry Adinanta, Cyber Security Director SecLab BDO Indonesia, dalam keterangan yang diterima detikINET. Selama ini SecLab BDO Indonesia sudah membantu dan bekerjasama dengan korporasi hingga lembaga pemerintahan untuk melakukan pengujian keamanan periodik, yang biasanya dilakukan dua kali dalam setahun, simulasi penyerangan siber, hingga analisa dampak dan rekomendasi tindak lanjut serta pencegahan. Jenis klien yang dimiliki SecLab BDO Indonesia mencakup perusahaan dari industri oil & gas, telekomunikasi, serta perbankan dan teknologi finansial, yang menurut aturan Otoritas Jasa Keuangan (OJK) serta Bank Indonesia (BI), harus menerapkan pengujian keamanan sebagai salah satu pemenuhan kepatuhan terhadap regulasi. ""Serangan seringkali didasari motif finansial, sehingga institusi perbankan paling sering menjadi sasaran serangan siber. Namun demikian, ada banyak kasus keamanan siber global lain dengan motif yang berbeda, misalnya state sponsored attack terhadap SolarWinds, atau serangan rantai pasok yang menghantam Quanta, perusahaan yang menyuplai produk ke Apple, bahkan sasaran industrial negara dan sangat penting seperti Colonial Pipeline di Amerika,"" kata Keith Douglas Trippie, Senior Cyber Security and Data Privacy Advisor BDO. ""Dampak kerugian akibat serangan siber global diperkirakan mencapai 2 Kuintiliun Dolar AS di awal 2022 kemarin, meningkat jauh dari 400 Miliar Dolar AS di tahun 2015, dan kerugian dari ransomware saja bisa mencapai 265 Miliar Dolar AS di tahun 2031. Sudah saatnya perusahaan di Indonesia memperkokoh ketahanan sibernya di tahun ini, dan mempersenjatai diri dengan framework keamanan siber yang jelas agar tidak menjadi korban berikutnya,"" tutupnya.";Jakarta - Salah satu masalah paling mendasar yang saat ini dihadapi oleh transaksi internet/transaksi elektronik adalah masalah keamanan sistem informasi dan perlindungan terhadap data pribadi. Berbagai faktor berkontribusi di dalam besarnya tingkat ketidakpercayaan pengguna internet dalam transaksi e-commerce, salah satu penyebab tertinggi adalah cyber criminal. Berdasarkan data Badan Siber dan Sandi Negara (BSSN), diketahui ada lebih dari 700 juta serangan siber yang terjadi di Indonesia pada tahun 2022. Baru-baru ini juga terjadi kebocoran data registrasi kartu SIM, di samping insiden-insiden besar sebelumnya yang melibatkan data kesehatan e-HAC, data kementerian, BUMN, hingga data pelanggan di e-commerce ternama. Di samping itu, Indonesia juga mengalami kekurangan tenaga ahli keamanan siber.;https://inet.detik.com/security/d-6323302/indonesia-kekurangan-tenaga-ahli-keamanan-siber
Google Ngaku Pernah di Bobol Hacker;25 October 2022;0,34848;hacking;"Jakarta - Siapa saja bisa jadi target serangan siber saat ini. Bahkan perusahaan sebesar Google juga pernah menjadi target serangan siber kelas kakap. Director of Government Affairs & Public Policy Google Indonesia Putri Alam mengatakan Google menjadi korban serangan siber setiap harinya. Beberapa tahun yang lalu, Google bahkan mengalami serangan siber fatal yang membuat mereka mengubah pendekatannya terhadap keamanan siber. Serangan siber itu merupakan salah satu kisah yang diangkat dalam serial dokumenter 'Hacking Google'. Putri mengatakan lewat serial ini Google ingin membagikan pembelajaran yang didapat dari pengalaman tersebut. ""Kami berharap upaya kami untuk berbagi pengalaman-pengalaman seperti ini dan juga transparan tentang ancaman dunia maya yang kami hadapi dapat menciptakan lebih banyak kepercayaan publik, meningkatkan kesadaran pengguna akan lanskap keamanan,"" kata Putri dalam acara nonton bareng 'Hacking Google' di Jakarta, Selasa (25/10/2022). Insiden itu terjadi pada tahun 2009, tidak lama setelah Google meluncurkan versi stabil sistem operasi Android. Pada 14 Desember 2009, VP of Security Engineering Google Heather Adkins dan timnya menemukan aktivitas tidak biasa berupa pesan yang dikirimkan kepada seorang karyawan. Pesan itu berisi link yang jika diklik akan mengarahkan korban ke situs yang mengunduh software berbahaya. Berkat malware ini, hacker berhasil menyusup ke jaringan Google dan mencuri kekayaan intelektual perusahaan. Serangan siber ini sempat membuat tim keamanan Google kebingungan karena serangan itu bisa mengubah taktik dengan sangat cepat. Akibatnya, tim keamanan Google memfokuskan kerjanya untuk satu masalah ini. Saking parahnya, tim keamanan Google sampai mengambil alih satu gedung kampus di markas mereka di Mountain View. Seluruh pakar keamanan Google juga berkumpul di Mountain View dan mengumpulkan semua hard drive yang ada di kampus untuk melakukan forensik. Saat menyelidiki sumber serangan ini, Google menemukan kode 'Aurora' di dalam kode berbahaya. Penemuan ini mendorong Google untuk memulai Operation Aurora dan mengubah cara mereka menangani masalah keamanan siber. Tim keamanan Google kemudian berhasil menendang hacker dari jaringannya setelah mengeluarkan semua perangkat karyawan dari jaringan dan mereset password. Pada tahun 2010, Google mengungkap serangan siber ini juga menargetkan 20 perusahaan lain dan dalang di balik serangan ini adalah pemerintah China. Setelah serangan siber tersebut, Google langsung mendirikan beberapa divisi khusus untuk menangani keamanan siber. Ada Threat Analysis Group yang bertugas memburu penjahat siber dan mengenali tekniknya. Ada juga Red Team, tim hacker yang bertugas menyerang produk-produk Google untuk menemukan celah di sistem keamanan perusahaan. Tim ini meniru strategi dan motif berbagai aktor jahat, mulai dari hacktivis sampai hacker yang dibekingi pemerintah.";Pada 14 Desember 2009, VP of Security Engineering Google Heather Adkins dan timnya menemukan aktivitas tidak biasa berupa pesan yang dikirimkan kepada seorang karyawan. Berkat malware ini, hacker berhasil menyusup ke jaringan Google dan mencuri kekayaan intelektual perusahaan. Tim keamanan Google kemudian berhasil menendang hacker dari jaringannya setelah mengeluarkan semua perangkat karyawan dari jaringan dan mereset password. Ada juga Red Team, tim hacker yang bertugas menyerang produk-produk Google untuk menemukan celah di sistem keamanan perusahaan. Tim ini meniru strategi dan motif berbagai aktor jahat, mulai dari hacktivis sampai hacker yang dibekingi pemerintah.;https://inet.detik.com/security/d-6368828/google-ngaku-pernah-dibobol-hacker-begini-kisahnya
Bjorka meracau! ledek pemburuan polisi dan kominfo;16 September 2022;0,51098;hacking;"Jakarta - Upaya perburuan terhadap Bjorka, mendapat olok-olok langsung dari sang hacker. Bahkan, Menkominfo Johnny G Plate kembali mendapat serangan verbal. Bjorka yang sempat menghilang dan kembali aktif pada Kamis kemarin. Inilah sejumlah ulahnya seperti dihimpun Jumat (16/9/2022). Dua orang pemuda bikin ramai media sosial karena diduga hacker Bjorka. Pertama, Instagram @volt_anonym menyebut Hacker Bjorka memiliki nama asli Muhammad Said Fikriansyah (17) dari Gunung Jati, Kabupaten Cirebon. Pekerjaannya video editor. Saat dijumpai wartawan, ia sendiri mengaku heran dan sangat terganggu dengan adanya tuduhan tersebut. Said yang tinggal di gang kecil Desa Klayan, membantah dirinya Bjorka. ""Jujur saya merasa terganggu banget (dituduh Bjorka),"" kata dia. Lalu yang kedua, pemuda berinisial MAH (21) asal Kabupaten Madiun diamankan Tim Cyber Mabes Polri, pukul 18.30 WIB, Rabu (14/9). MAH merupakan warga Desa Banjarsari Kulon, Kecamatan Dagangan, Madiun. MAH kemudian oleh Tim Cyber dibawa ke Mapolsek Dagangan untuk menjalani pemeriksaan. MAH menjalani pemeriksaan hingga sekitar pukul 01.30 WIB dan mendapat pengamanan dari Polres Madiun.";"Jakarta - Upaya perburuan terhadap Bjorka, mendapat olok-olok langsung dari sang hacker. Inilah sejumlah ulahnya seperti dihimpun Jumat (16/9/2022). Dua orang pemuda bikin ramai media sosial karena diduga hacker Bjorka. Saat dijumpai wartawan, ia sendiri mengaku heran dan sangat terganggu dengan adanya tuduhan tersebut. ""Jujur saya merasa terganggu banget (dituduh Bjorka),"" kata dia.";https://inet.detik.com/security/d-6294534/bjorka-meracau-ledek-perburuan-polisi-dan-serang-menkominfo
Pakar Cyber Ragu Bjorka Orang Indonesia;15 September 2022;0,94514;hacking;"Jakarta- Siapa Bjorka dan identitas Bjorka masih dicari banyak orang. Akan tetapi pakar keamanan siber, Alfons Tanujaya dari Vaksincom, ragu bahwa Bjorka adalah orang Indonesia. Bjorka sendiri sudah melakukan beberapa aksi penyebaran data pemerintahan dan melakukan doxing kepada pejabat penting. Kepada detikINET, Kamis (15/9/2022), melalui pesan singkat, Alfons pun menyebutkan alasannya ragu bahwa Bjorka adalah orang Indonesia. ""Saya pribadi ragu kalau ini orang Indonesia, meskipun banyak yang bilang kemungkinan besar Bjorka ini orang Indonesia. Risikonya terlalu tinggi kalau dia orang Indonesia atau berdomisili di Indonesia dan melakukan hal ini,"" kata Alfons.";"Jakarta- Siapa Bjorka dan identitas Bjorka masih dicari banyak orang. Akan tetapi pakar keamanan siber, Alfons Tanujaya dari Vaksincom, ragu bahwa Bjorka adalah orang Indonesia. Bjorka sendiri sudah melakukan beberapa aksi penyebaran data pemerintahan dan melakukan doxing kepada pejabat penting. ""Saya pribadi ragu kalau ini orang Indonesia, meskipun banyak yang bilang kemungkinan besar Bjorka ini orang Indonesia. Risikonya terlalu tinggi kalau dia orang Indonesia atau berdomisili di Indonesia dan melakukan hal ini,"" kata Alfons.";https://inet.detik.com/security/d-6293435/pakar-siber-ragu-bjorka-orang-indonesia
