Judul;Date;cosine;Kategori;Artikel;Summary;Link
Kemenkominfo Gelar Webinar 'Rahasia Membuat Konten Viral';14 October 2022;0,48931;cyber security;"PADA awal 2022. Hootsuite dan We Are Social melaporkan jumlah pengguna internet Indonesia telah mencapai 204,7 orang atau meningkat 2,1 juta dari tahun sebelumnya. Masifnya kemajuan teknologi ini mampu memberikan potensi risiko seperti penipuan online seperti hoaks dan cyber bullying. Oleh karena itu, peningkatan penggunaan teknologi harus diimbangi dengan peningkatan kapasitas literasi digital yang mempuni. “Survei Nasional yang dilakukan tahun lalu menemukan jika saat ini indeks literasi digital Indonesia masih berada pada angka 3,49 dari skala 5 atau masih kategori sedang belum mencapai kategori baik. Hal ini perlu terus ditingkatkan untuk membekali peningkatan kapasitas literasi digital,” ujar Dirjen  Aplikasi Informatika (Aptika) Kementerian Komunikasi dan Informatika (Kemenkominfo), Samuel Abrijani Pengerapan.      Kemenkominfo sebagai pengemban garda terdepan dalam memimpin upaya percepatan transformasi digital bangsa Indonesia memiliki tugas sebagai regulator, fasilitator, dan akselerator. Dalam rangka menjalankan mandat tersebut terkait dengan pengembangan SDM Kemenkominfo bersama dengan Gerakan Nasional Literasi Digital Siberkreasi telah melakukan literasi digital kepada lebih dari 14,6 juta orang. Dalam perjalanannya Program #MakinCakapDigital sejak pertama kali diluncurkan pada tahun 2021 yang lalu, berfokus pada peningkatan wawasan dan kecakapan digital masyarakat Indonesia yang diukur berdasarkan empat pilar digital, yaitu Kecakapan Digital, Etika Digital, Keamanan Digital, dan Budaya Digital. “Pada tahun 2022 akan diberikan pelatihan literasi digital kepada 5,5 juta masyarakat. Kinerja literasi digital pun mulai menunjukkan peningkatan dari segi kualitas. Peluang kecakapan digital tersebut perlu dimanfaatkan secara optimal, mengingat kita memiliki potensi sumber daya manusia yang besar,” ujar Menkominfo Johnny G. Plate dalam sambutan program Makin Cakap Digital.  Program “Indonesia Makin Cakap Digital 2022”. Program ini bertujuan untuk membangun wawasan dan pengetahuan terkait literasi digital dalam bentuk webinar (seminar dan diskusi secara online), talkshow dalam format hybrid (offline dan online), serta special event penunjang kegiatan literasi digital. Kegiatan ini diharapkan dapat memberikan kontribusi bagi upaya menghentikan penyebaran berita hoaks serta dampak negatif dari penyalahgunaan internet dengan cara meningkatkan kemampuan kognitif masyarakat Indonesia melalui beragam program edukasi kecakapan literasi digital. Menjadi literat digital berarti dapat memproses berbagai informasi, dapat memahami pesan, dan berkomunikasi efektif dengan orang lain dalam berbagai bentuk. Selain itu dengan cakap literasi digital dapat memacu individu untuk beralih dari konsumen yang pasif menjadi produsen yang aktif, baik secara individu maupun sebagai bagian dari komunitas. Dengan literasi digital juga akan tercipta tatanan masyarakat dengan pola pikir dan pandangan yang kritis serta kreatif.  Anggota masyarakat tidak akan mudah termakan oleh isu yang provokatif dan menjadi korban informasi hoaks atau korban penipuan yang berbasis digital. Pada Rabu (12/10),Kemenkominfo bersama siberkreasi telah menyelenggarakan kegiatan webinar di bulan Oktober untuk kelompok masyarakat / komunitas di wilayah Sumatra dengan tema “Tips Dunia Digital: Rahasia Membuat Konten Viral"". Webinar tersebut dihadiri oleh lebih dari 1.300 orang, menghadirkan narasumber Indiriyanto Banyumurti, Direktur Eksekutif ICT Watch; Sukma Nurjagat, Relawan Mafindo Jakarta & Praktisi Literasi Digital; Julita Hazeliana, Komite Edukasi Mafindo & Praktisi Literasi Digital , sebagai narasumber. Dalam webinar tersebut, Indiriyanto Banyumurti membahas mengenai rahasia membuat konten viral ditinjau dari perspektif cakap digital. ”Konten merupakan informasi yang dapat diungkap melalui beberapa media, seperti gambar, tulisan, video, atau bentuk lainnya. Empat tips yang dapat dilakukan untuk membuat konten viral,"" jela Indiriyanto. Pertama, konsisten dalam membuat dan memposting konten. Kedua, buatlah konten yang unik dengan menggabungkan audio yang populer. Ketiga, gunakan design yang menarik. Terakhir, ikuti trend dan challenge”, papar Indiriyanto Banyumurti. Sukma Nurjagat memperkaya pembahasan mengenai rahasia membuat konten viral ditinjau dari perspektif etis digital. “Berikut beberapa tips yang dapat dilakukan untuk tetap berperilaku etis setiap membuat konten viral. Pertama, tidak membuat konten yang menjelek jelek kan brand lain,"" jelasnya. ""Kedua, selalu memberikan informasi yang jujur. Terakhir, selalu pahami jika komunikasi yang kita lakukan di dunia digital adalah komunikasi yang dilakukan antar manusia bukan manusia dengan teknologi,” ujar Sukma Nurjagat. Julita Hazeliana melengkapi pembahasan mengenai rahasia membuat konten viral ditinjau dari perspektif pilar aman digital. “Apapun aktivitas yang kita lakukan di ruang digital tidak pernah ada yang 100% aman, karenanya selalu berpikir kritis dan tidak mudah percaya dengan semua hal yang ada di internet dapat menjadi satu proteksi keamanan yang paling efektif untuk menghindarkan kita dari tindakan kejahatan internet,""  papar Julita. (RO/OL-09)";PADA awal 2022. Hootsuite dan We Are Social melaporkan jumlah pengguna internet Indonesia telah mencapai 204,7 orang atau meningkat 2,1 juta dari tahun sebelumnya. Masifnya kemajuan teknologi ini mampu memberikan potensi risiko seperti penipuan online seperti hoaks dan cyber bullying. Oleh karena itu, peningkatan penggunaan teknologi harus diimbangi dengan peningkatan kapasitas literasi digital yang mempuni. “Survei Nasional yang dilakukan tahun lalu menemukan jika saat ini indeks literasi digital Indonesia masih berada pada angka 3,49 dari skala 5 atau masih kategori sedang belum mencapai kategori baik.;https://mediaindonesia.com/humaniora/529813/kemenkominfo-gelar-webinar-rahasia-membuat-konten-viral
Media Massa Harus Sajikan informasi Akurat, Faktual, dan Akuntabel;23 September 2022;0,60214;cyber security;"PEMBANGUNAN kesehatan nasional merupakan salah satu hal yang menjadi fokus pemerintah. Salah satu upaya yang dapat dilakukan adalah dengan memastikan pemahaman seputar pentingnya kesehatan, pemenuhan nutrisi dan hidrasi serta gaya hidup sehat. Menjawab hal tersebut, Danone Indonesia bekerja sama dengan Asosiasi Media Siber Indonesia (AMSI) menggelar program 'Cyber Media Forum'. Program 'Cyber Media Forum' sebagai program edukasi untuk peningkatan kompetensi bagi media online dan membangun ruang berbagi media dalam menghasilkan hasil karya jurnalistik dalam isu kesehatan di berbagai portal berita. Program edukasi publik yang bertema “Potret dan Tantangan Kesehatan Masyarakat Menjelang Endemi Covid-19” berlangsung secara virtual baru-baru ini. Acara ini dihadiri oleh 40 media nasional dan lokal dengan pembicara dari berbagai multidisiplin yakni Drg. Widyawati, MKM, Direktur Promosi Kesehatan Kemenkes, Dr.Nurul Ratna, M.Gizi, SpGK, Ketua Dep.Ilmu Gizi FKUI, Dr. CSP Wekadigunawan, MPH, Ph.D, Pengurus Pusat IAKMI, Uyung Pramudiarja, Redaktur Pelaksana Detik Health.  Acara ini juga dibuka oleh Sekretaris Jendral AMSI, Wahyu Dyatmika dan Corporate Communications Director Danone Indonesia, Arif Mujahidin. Saat ini jumlah pengguna internet nasional melonjak sebesar 54,25% dengan penetrasi internet mencapai 73,7% dari total penduduk Indonesia (We Are Social 2022). Lalu data dari Reuters Institute menunjukkan mayoritas masyarakat Indonesia memanfaatkan sejumlah media daring dalam mengkonsumsi berita. Kondisi ini menjadi peluang yang sangat strategis bagi media massa online untuk mengambil peran mengedukasi masyarakat khususnya dalam isu yang utama bagi masyarakat seperti isu seputar kesehatan. Wahyu Dyatmika, Sekjen Asosiasi Media Siber Indonesia, mengatakan,“Di tengah situasi kesehatan nasional yang masih menjadi tantangan tersendiri bagi publik dan pemerintah, maka sebagai insan pers yang menjalankan perannya sebagai sumber penyedia informasi."" ""Insan pers diharapkan dapat mengangkat berita tentang isu kesehatan yang terverifikasi dari sumber-sumber kredibel, sehingga dapat menjadi rujukan bagi publik agar mereka mampu menyikapi informasi dengan tepat sasaran,” jelas Wahyu. Arif Mujahidin, Corporate Communication Director Danone Indonesia menjelaskan, “Pertumbuhan informasi di digital yang begitu cepat merupakan tantangan yang harus mampu diimbangi oleh media massa namun tetap memegang prinsip informasi yang akurat, faktual, dan akuntabel.""  Upaya untuk meningkatkan kualitas jurnalisme terus dilakukan dengan cara memberikan pendidikan dan uji kompetensi rekan-rekan jurnalis. ""Selain dari tujuan kami terhadap peningkatan jurnalis, kami juga berkomitmen untuk mendukung pemerintah dalam mengedukasi masyarakat akan isu kesehatan dan nutrisi melalui jurnalis sebagai key opinion leader dalam menyebarkan informasi kepada masyarakat,"" jelas Arif. ""Sebagaimana misi kami yakni membawa kesehatan ke sebanyak mungkin orang,  kami terus berkomitmen untuk membawa kesehatan ke banyak masyarakat tidak hanya melalui operasional bisnis kami namun juga upaya edukasi yang dilakukan untuk publik,"" paparnya. Program Cyber Media Forum dirancang dengan format workshop online yang diikuti oleh media siber anggota AMSI dari Jabodetabek, Jawa Barat, Jawa Tengah, Jawa Timur,, Bali, Sumatera Barat, Lampung, Medan, Manado, Makassar, Kalimantan, Papua. Materi seputar kesehatan, nutrisi dan hidrasi dihadirkan untuk meningkatkan pengetahuan maupun soft skills dari para peserta. Direktur Promosi Kesehatan Kemenkes, Drg. Widyawati, MKM, menyampaikan materi seputar perkembangan penanganan Covid-19 dan isu kesehatan masyarakat. Widyawati menjelaskan, “Dalam penanganan permasalahan kesehatan, pemerintah akan terus melakukan kebijakan sesuai dengan perkembangan terbaru terhadap beberapa isu kesehatan prioritas seperti penanganan Covid-19 hingga stunting."" ""Indikator kesehatan di Indonesia termasuk penanganan Covid-19 dapat membaik dengan kolaborasi multipihak dan dukungan dari masyarakat dan media,"" katanya. "" Adapun beberapa kebiasaan baik yang tercipta selama pandemi beberapa tahun terakhir seperti  penerapan protokol kesehatan disertai makan sehat dan gizi yang seimbang dibutuhkan sesuai dengan Gerakan Masyarakat Hidup Sehat (Germas) dan implementasi pedoman isi piringku, sangatlah penting tidak hanya dalam percepatan penanganan pandemi namun juga menjaga kesehatan masyarakat secara luas,” jelasnya. Ketua Departemen Ilmu Gizi FKUI, Dr. Nurul Ratna, M. Gizi,SpGK memaparkan tentang tema ""Hidrasi Sehat Bagi Keluarga"". Nurul mengatakan, “Air di dalam tubuh kita adalah hal yang sangat penting. Tanpa adanya air yang cukup dan berkualitas, organ tubuh vital tidak dapat berfungsi dengan baik."" ""Sayangnya, tidak semua orang menyadari besarnya fungsi air dalam tubuh sehingga sering kurang minum,"" ujarnya. Saat ini penelitian menunjukkan bahwa 1 dari 5 anak-anak dan remaja belum cukup minum, dan juga 1 dari 4 orang dewasa belum cukup minum. ""Padahal setidaknya kita dianjurkan untuk minum minimal 2 liter per hari untuk orang dewasa dan 1,2 liter perhari untuk anak-anak,"" jelas Nurul. Selain itu, penting juga bagi kita untuk memperhatikan kriteria air minum yang baik, yaitu tidak berwarna, tidak berbau, tidak berasa dan tidak mengandung zat-zat berbahaya. Hal yang perlu diingat juga kita harus memastikan sumber air nya murni, berkualitas dan terlindungi. Terlepas dari permasalahan kesehatan dan nutrisi yang terjadi, saat ini masyarakat juga masih dibayangi akan tantangan kesehatan masyarakat pasca pandemi.  Pengurus Pusat IAKMI - Dr.CSP Wekadigunawan, MPH, Ph.D menyampaikan materi tentang Tantangan Masalah Kesehatan Masyarakat di Masa Endemi Covid-19. Wekadigunawan menjelaskan, “Pandemi Covid-19 telah membukakan mata dan kesadaran banyak pihak bagaimana esensi kesehatan berperan penting tidak hanya dalam kehidupan seseorang, namun juga dalam lingkup masyarakat yang lebih luas."" ""Terlepas dari permasalahan Covid-19, Indonesia juga menghadapi berbagai permasalahan kesehatan baik masalah kesehatan yang menular dan tidak menular yang disebabkan oleh faktor lingkungan, gizi dan nutrisi dan berbagai faktor lainnya,"" jelasnya. Sehingga mitigasi dan pencegahan sebagai bentuk kesiapan akan terjadinya permasalahan kesehatan lainnya dibutuhkan. Di sisi lain, kreativitas dalam penulisan isu kesehatan dan counter berita palsu juga menjadi hal yang penting untuk dimiliki oleh rekan jurnalis, agar output yang dihasilkan dapat diminati para pembaca terlepas dari seberapa tinggi konten yang ada didalamnya. Untuk itu, tema tersebut juga dibawakan dalam program Cyber Media Forum oleh Redaktur Pelaksana Detik Health - Uyung Pramudiarja. Uyung menuturkan,“Akibat dari momentum Covid-19 isu kesehatan dalam pemberitaan selalu menarik karena dekat dengan keseharian semua orang."" ""Melalui adanya peningkatan skill program ini kita diharapkan dapat menjawab tantangan dalam pengemasan berita yang menarik dengan tetap memperhatikan etika jurnalistik agar informasi yang diterima masyarakat mendalam, akurat dan menghadirkan solusi dari permasalahan kesehatan,"" jelasnya. (RO/OL-09)";PEMBANGUNAN kesehatan nasional merupakan salah satu hal yang menjadi fokus pemerintah. Salah satu upaya yang dapat dilakukan adalah dengan memastikan pemahaman seputar pentingnya kesehatan, pemenuhan nutrisi dan hidrasi serta gaya hidup sehat. Menjawab hal tersebut, Danone Indonesia bekerja sama dengan Asosiasi Media Siber Indonesia (AMSI) menggelar program 'Cyber Media Forum'. Program 'Cyber Media Forum' sebagai program edukasi untuk peningkatan kompetensi bagi media online dan membangun ruang berbagi media dalam menghasilkan hasil karya jurnalistik dalam isu kesehatan di berbagai portal berita. Program edukasi publik yang bertema “Potret dan Tantangan Kesehatan Masyarakat Menjelang Endemi Covid-19” berlangsung secara virtual baru-baru ini.;https://mediaindonesia.com/humaniora/524936/xxxx
Keamanan data pribadi digital di ruang cyber;12 September 2022;0,57858;cyber security;"WE live in the digital age!” Kita sedang hidup di era digital. Begitu cuplikan pesan Perserikatan Bangsa-Bangsa (PBB) tahun 2013 tentang tren datafikasi (datafication) warga-negara akhir-akhir ini di berbagai negara. Bahan bakar era digital, papar ahli matematika asal Inggris, Clive Humby, ialah data. Begitu dampak revolusi teknologi informasi dan platform-platform digital sejak akhir abad 20. Maka kini dunia memasuki era ‘collective intelligence’ melalui big data dan era baru kapitalisme data. Bagaimana sosok “kapitalisme data” awal abad 21? Asal-usulnya, tulis Zuboff (2019), ialah eksploitasi profil-profil konsumen secara rinci tentang informasi pribadi lengkap atau parsial sebagai unsur pokok banyak kegiatan ekonomi-politik. Era digital bukan cuma pantau data real-time orang per orang dan masyarakat, tetapi juga sifat data hasil produksi, proses, model, dan sharing data. Apa contoh risiko kapitalisme data? Hingga awal Maret 2022, lebih dari empat ribu kasus kriminal berupa pelanggaran data dan informasi pribadi terjadi di Tiongkok sejak tahun 2021. Begitu isi laporan kerja Mahkamah Agung Rakyat Tiongkok pada Rapat Pleno ke-2 sesi sidang ke-5 Kongres Rakyat Nasional ke-13, Selasa 8 Maret 2022 di Beijing, Tiongkok (Global Times, 8/3/2022). Ketua MA Rakyat Tiongkok, Zhou Qiang (2022), menyebut bahwa pengadilan negeri Tiongkok telah menyelidiki dan memutuskan 4.098 kasus kriminal pelanggaran data warga negara dalam bentuk antara lain jual-beli data pribadi, akun WeChat, informasi pasien, penipuan identitas, dan sejenisnya. Kejahatan-kejahatan itu terlacak sejak Tiongkok menerapkan Data Security Law dan Security Protection Regulations on Critical Information Infrastructure tahun 2021. Tiongkok juga menerapkan Undang-undang Perlindungan Informasi Pribadi (Personal Information Protection Law /PIPL) tentang perlindungan data pribadi dan keamanan siber sejak November 2021. Pelanggar ketentuan UU ini dapat dihukum dengan denda maksimum 158.321 dolar AS atau sekitar satu juta yuan. Apakah UU, regulasi, dan teknologi dapat melindungi data digital warga-negara di ruang siber? Akhir September 2018, Pemerintah Singapura merilis proyek ‘Virtual Singapore’ senilai 73 juta dollar (Singapura). Program ini menyediakan model 3D simulasi keamanan negara, perencanaan kota, hingga mitigasi bencana alam di Singapura yang berpenduduk 5,6 juta jiwa. Dari Dublin, Irlandia, 6 September 2022, pers merilis upaya Instagram mengajukan banding terhadap keputusan Data Protection Commission Irlandia menjatuhkan denda senilai 405 juta euro terhadap jejaring Instagram karena kebocoran data email dan telepon remaja (usia 13-17 tahun). Kini ‘Virtual Singapore’ menyisakan sejumlah risiko, antara lain privasi, surveilens dari jaringan kamera-intai perangkat lunak pengenal wajah (facial recognition), keamanan data, dan akurasi data. Apalagi, 1,5 juta data warga Singapura, misalnya, diretas oleh hacker tahun 2018 (Reuters, 27/9/2018). Maka dibutuhkan regulasi, legislasi, perangkat teknologi, dan kualitas (kompetensi, keahlian, dan pengetahuan) SDM (sumber daya manusia) guna menjamin dan melindung data pribadi-digital warga-negara di ruang siber. Di Indonesia, Komisi I DPR dan pemerintah pada 7 September ini telah menyetujui pengesahan Rancangan Undang-Undang Perlindungan Data Pribadi (RUU PDP). Pasal 67-69 RUU-PDP, antara lain, mengatur sanksi pidana terhadap pelanggaran penggunaan data pribadi warga-negara. Ancaman pidana atas pelanggaran – sengaja dan melawan hukum berupa memperoleh atau mengumpulkan data pribadi bukan milik, menguntungkan diri atau orang lain – berkisar maksimal lima tahun pidana penjara. Awal September ini, pers nasional merilis isu sejumlah dokumen surat menyurat yang diduga milik Presiden Joko Widodo tahun 2019-2021, termasuk kumpulan surat dari Badan Intelijen Negara (BIN), diretas akun Bjorka BreachForums. Ahmad Naufal Dzulfaroh et al. (2022) edisi Kompas.com (20/8/2022) merilis laporan tentang dugaan kebocoran data warga-negara antara lain data Direktorat Jenderal Pajak (DJP) dan Kartu Prakerja melalui platform dark-web pada Maret 2022; sekitar enam juta data pasien, misalnya, hasil pemeriksaan radiologi, hasil CT Scan, tes Covid-19, hingga rontgen (XRay), diduga bocor dan dijual di forum online Raid Forums oleh akun “Astarte” pada Januari 2022; jutaan data penduduk (peserta BPJS) Indonesia yang diduga bocor dan dijual di Raid Forums pada Mei 2021.";Begitu dampak revolusi teknologi informasi dan platform-platform digital sejak akhir abad 20. Hingga awal Maret 2022, lebih dari empat ribu kasus kriminal berupa pelanggaran data dan informasi pribadi terjadi di Tiongkok sejak tahun 2021. Tiongkok juga menerapkan Undang-undang Perlindungan Informasi Pribadi (Personal Information Protection Law /PIPL) tentang perlindungan data pribadi dan keamanan siber sejak November 2021. Pelanggar ketentuan UU ini dapat dihukum dengan denda maksimum 158.321 dolar AS atau sekitar satu juta yuan. Akhir September 2018, Pemerintah Singapura merilis proyek ‘Virtual Singapore’ senilai 73 juta dollar (Singapura).;https://www.kompas.com/tren/read/2022/09/12/085017765/keamanan-data-pribadi-digital-di-ruang-siber?page=all
Imigrasi sebut nomad asing di canggu rawan picu kejahatan cyber;3 October 2022;0,80602;hacking;"Bandung - Maraknya wisatawan yang bekerja sebagai tenaga IT freelance atau digital nomad di kawasan Canggu, Kuta Utara, Badung dinilai rawan memicu kejahatan cyber. Untuk itu, Direktorat Jendral Imigrasi Kementerian Hukum dan Hak Asasi Manusia RI pun menaruh atensi terkait keberadaan mereka. Seperti disampaikan Plt. Dirjen Imigrasi Kemenkumham Indonesia, Widodo Ekatjahjana, Senin (3/10/2022). ""Kita akan inforce penegakan hukum karena itu kewenangan atributif yang diberikan oleh Undang-undang,"" ujar Widodo disela-sela sidak di dua beach club terbesar di kawasan Canggu yakni Finns Bech Club' dan Atlas Beach Fest, Senin (3/10/2022). Untuk diketahui, kawasan Canggu kini berubah. Kawasan Wisata di Badung Utara ini, kini menjadi surganya bagi wisatawan asing yang bekerja sebagai digital nomad. Hal itu diungkap oleh Menteri Pariwisata dan Ekonomi Kreatif Sandiaga Salahuddin Uno beberapa waktu lalu. Menurutnya, para wisatawan tersebut bekerja di Canggu dengan lokasi usaha di luar Bali. Yang ditakutkan adalah wisatawan yang datang tersebut bukanlah turis berkualitas. ""Jadi kita berharap juga, mengapa imigrasi juga perlu melakukan pengawasan terhadap orang asing kita khawatirkan terutama kejahatan cyber yang susah sekali kita melacaknya,"" tukasnya. Sementara itu, menanggapi adanya digital nomad di Canggu, Humas Corporate Atlas Beach Fest Tommy Dimas mengaku kaget dengan data yang menyebut nomad di Canggu masuk daftar nomor tiga di dunia. Menurut Dimas, Canggu dan Berawa antara dahulu dan kini sudah berubah. Saat ini, kata Dimas, Canggu banyak kedatangan turis. Untuk itu, dengan adanya sidak dan monitoring dari Imigrasi, pihaknya menegaskan tidak mempermasalahkannya. ""Tidak masalah sih, justru kami mendukung,"" tukasnya.";"Bandung - Maraknya wisatawan yang bekerja sebagai tenaga IT freelance atau digital nomad di kawasan Canggu, Kuta Utara, Badung dinilai rawan memicu kejahatan cyber. ""Kita akan inforce penegakan hukum karena itu kewenangan atributif yang diberikan oleh Undang-undang,"" ujar Widodo disela-sela sidak di dua beach club terbesar di kawasan Canggu yakni Finns Bech Club' dan Atlas Beach Fest, Senin (3/10/2022). Kawasan Wisata di Badung Utara ini, kini menjadi surganya bagi wisatawan asing yang bekerja sebagai digital nomad. ""Jadi kita berharap juga, mengapa imigrasi juga perlu melakukan pengawasan terhadap orang asing kita khawatirkan terutama kejahatan cyber yang susah sekali kita melacaknya,"" tukasnya. Sementara itu, menanggapi adanya digital nomad di Canggu, Humas Corporate Atlas Beach Fest Tommy Dimas mengaku kaget dengan data yang menyebut nomad di Canggu masuk daftar nomor tiga di dunia.";https://www.detik.com/bali/hukum-dan-kriminal/d-6327475/imigrasi-sebut-nomad-asing-di-canggu-rawan-picu-kejahatan-cyber
