Judul;Date;cosine;Kategori;Artikel;Summary;Link
Google Ngaku Pernah di Bobol Hacker;25 October 2022;0,34848;botnet;"Jakarta - Siapa saja bisa jadi target serangan siber saat ini. Bahkan perusahaan sebesar Google juga pernah menjadi target serangan siber kelas kakap. Director of Government Affairs & Public Policy Google Indonesia Putri Alam mengatakan Google menjadi korban serangan siber setiap harinya. Beberapa tahun yang lalu, Google bahkan mengalami serangan siber fatal yang membuat mereka mengubah pendekatannya terhadap keamanan siber. Serangan siber itu merupakan salah satu kisah yang diangkat dalam serial dokumenter 'Hacking Google'. Putri mengatakan lewat serial ini Google ingin membagikan pembelajaran yang didapat dari pengalaman tersebut. ""Kami berharap upaya kami untuk berbagi pengalaman-pengalaman seperti ini dan juga transparan tentang ancaman dunia maya yang kami hadapi dapat menciptakan lebih banyak kepercayaan publik, meningkatkan kesadaran pengguna akan lanskap keamanan,"" kata Putri dalam acara nonton bareng 'Hacking Google' di Jakarta, Selasa (25/10/2022). Insiden itu terjadi pada tahun 2009, tidak lama setelah Google meluncurkan versi stabil sistem operasi Android. Pada 14 Desember 2009, VP of Security Engineering Google Heather Adkins dan timnya menemukan aktivitas tidak biasa berupa pesan yang dikirimkan kepada seorang karyawan. Pesan itu berisi link yang jika diklik akan mengarahkan korban ke situs yang mengunduh software berbahaya. Berkat malware ini, hacker berhasil menyusup ke jaringan Google dan mencuri kekayaan intelektual perusahaan. Serangan siber ini sempat membuat tim keamanan Google kebingungan karena serangan itu bisa mengubah taktik dengan sangat cepat. Akibatnya, tim keamanan Google memfokuskan kerjanya untuk satu masalah ini. Saking parahnya, tim keamanan Google sampai mengambil alih satu gedung kampus di markas mereka di Mountain View. Seluruh pakar keamanan Google juga berkumpul di Mountain View dan mengumpulkan semua hard drive yang ada di kampus untuk melakukan forensik. Saat menyelidiki sumber serangan ini, Google menemukan kode 'Aurora' di dalam kode berbahaya. Penemuan ini mendorong Google untuk memulai Operation Aurora dan mengubah cara mereka menangani masalah keamanan siber. Tim keamanan Google kemudian berhasil menendang hacker dari jaringannya setelah mengeluarkan semua perangkat karyawan dari jaringan dan mereset password. Pada tahun 2010, Google mengungkap serangan siber ini juga menargetkan 20 perusahaan lain dan dalang di balik serangan ini adalah pemerintah China. Setelah serangan siber tersebut, Google langsung mendirikan beberapa divisi khusus untuk menangani keamanan siber. Ada Threat Analysis Group yang bertugas memburu penjahat siber dan mengenali tekniknya. Ada juga Red Team, tim hacker yang bertugas menyerang produk-produk Google untuk menemukan celah di sistem keamanan perusahaan. Tim ini meniru strategi dan motif berbagai aktor jahat, mulai dari hacktivis sampai hacker yang dibekingi pemerintah.";Pada 14 Desember 2009, VP of Security Engineering Google Heather Adkins dan timnya menemukan aktivitas tidak biasa berupa pesan yang dikirimkan kepada seorang karyawan. Berkat malware ini, hacker berhasil menyusup ke jaringan Google dan mencuri kekayaan intelektual perusahaan. Tim keamanan Google kemudian berhasil menendang hacker dari jaringannya setelah mengeluarkan semua perangkat karyawan dari jaringan dan mereset password. Ada juga Red Team, tim hacker yang bertugas menyerang produk-produk Google untuk menemukan celah di sistem keamanan perusahaan. Tim ini meniru strategi dan motif berbagai aktor jahat, mulai dari hacktivis sampai hacker yang dibekingi pemerintah.;https://inet.detik.com/security/d-6368828/google-ngaku-pernah-dibobol-hacker-begini-kisahnya
Awas google translate palsu bisa curi data kita;18 October 2022;0,7705;botnet;Jakarta- Peneliti keamanan di Avanan menemukan aksi pencurian data dengan teknik phishing yang memanfaatkan 'Google Translate' tiruan. Temuan ini diawali dari deretan email phishing berbahasa Spanyol yang ditemukan oleh para peneliti keamanan Siber di Avanan. Seperti email phishing pada umumnya, pengirim email mengaku berasal dari penyedia layanan email yang dipakai calon korban. Calon korbannya ini ditakut-takuti dengan disebut kalau identitasnya belum terkonfirmasi, dan mereka bisa kehilangan akses ke email yang belum terbaca jika tak segera bertindak, yaitu mengkonfirmasi identitasnya. Peneliti keamanan di Avanan pun melihat email ini menggunakan taktik standar dalam aksi phishing, yaitu menyusupkan tautan ke situs tiruan, dalam hal ini Google Translate, untuk mencuri data korbannya. Tautan ke Google Translate palsu itu jika diklik akan mengarahkan calon korban ke situs yang menyerupai laman penerjemah buatan Google tersebut. Namun bedanya, di bagian atas laman ada kotak yang muncul dan meminta calon korban untuk memasukkan user ID dan password-nya. Tentu jika ada yang tertipu dan memasukkan data tersebut ke dalam boks, user ID dan password itu tak akan masuk ke server Google, melainkan masuk ke dalam server milik si pelaku. Menariknya, situs Google Translate tiruan ini terlihat sangat otentik. Menurut peneliti Avanan, si pelaku menggunakan banyak kode Javascript untuk membuat situs tersebut terlihat asli. Bahkan mereka juga menggunakan perintah Unescape untuk menyembunyikan tujuan utama mereka, demikian dikutip detikINET dari Techradar, Selasa (18/10/2022). Mereka pun menyebut kalau pelaku menggunakan bermacam trik dari taktik phishing untuk bisa meyakinkan calon korban. Misalnya ada aspek rekayasa sosial pada bagian awal, lalu meniru situs populer untuk mencuri data, dan memakai obfuscation untuk menipu layanan keamanan. Tentunya, Google Translate yang asli tak meminta pengguna login untuk bisa menggunakan layanannya.;Jakarta- Peneliti keamanan di Avanan menemukan aksi pencurian data dengan teknik phishing yang memanfaatkan 'Google Translate' tiruan. Temuan ini diawali dari deretan email phishing berbahasa Spanyol yang ditemukan oleh para peneliti keamanan Siber di Avanan. Tautan ke Google Translate palsu itu jika diklik akan mengarahkan calon korban ke situs yang menyerupai laman penerjemah buatan Google tersebut. Namun bedanya, di bagian atas laman ada kotak yang muncul dan meminta calon korban untuk memasukkan user ID dan password-nya. Mereka pun menyebut kalau pelaku menggunakan bermacam trik dari taktik phishing untuk bisa meyakinkan calon korban.;https://inet.detik.com/security/d-6355821/awas-ada-google-translate-palsu-bisa-curi-data
Rumania Pastikan Dukung Indonesia di Dewan Telko Dunia;20 October 2022;0,68963;cyber security;"Bucharest - Menteri Riset, Inovasi dan Digitalisasi Rumania, Sebastian-Ioan Burduja memastikan negaranya mendukung pencalonan Indonesia sebagai anggota dewan di International Telecommunication Union (ITU) dan Radio Regulations Board (RRB) Region E Asia Australasia. ""100% kami dukung Indonesia,"" ujarnya saat ditemui usai bertemu dengan Menteri Komunikasi dan Informatika (Menkominfo) Johnny G Plate di sela-sela sidang ITU Plenipotentiary Conference ke-21 pada Rabu pagi (28/9/2022) di Palace of Parliament, Bucharest, Rumania. Dia mengatakan Rumania dan Indonesia memiliki chemistry yang sangat positif. Karena itu sudah sepatutnya untuk saling mendukung satu sama lain. Burduja berharap negaranya dapat belajar dari kisah sukses Indonesia dalam menciptakan unicorn, memfasilitasi ekosistem inovasi, memanfaatkan sumber daya manusia yang dimiliki negara. ""Indonesia adalah bangsa yang besar, dan sekali lagi, ada begitu banyak yang bisa dipelajari darinya,"" ujarnya. Pihaknya pun berharap dapat bekerja sama dengan pemerintah Indonesia. Salah satunya dalam bidang keamanan siber. ""Kami berharap dapat berkontribusi dalam keamanan cyber. Ini sebagai salah satu aspek paling penting di dunia terutama di saat seperti ini, yang dijadikan sarana perang modern, tentu saja termasuk komponen cyber. Serta keahlian kami dalam penelitian dan pengembangan, pusat akademik, dan kami sangat berharap untuk melanjutkan kemitraan ini,"" pungkas Burduja. Sementara itu, Menkominfo menyampaikan rasa terima kasih dan penghargaan kepada pemerintah Rumania dalam mengatur konferensi ITU yang dinilainya sangat baik. Dalam pertemuan yang berlangsung kurang dari 30 menit, Menkominfo sempat memaparkan kebijakan tentang bagaimana Indonesia berupaya dalam ikut ambil bagian mengurangi kesenjangan digital, sehingga 2,7 miliar orang yang tidak terhubung makin berkurang. Selain itu kedua belah pihak mendiskusikan banyak hal terkait digital talent, cyber security, radio communication, serta upstream and downstream infrastructure, termasuk di dalamnya potensi-potensi membangun hubungan sektor ekonomi digital. ""Saya sampaikan Indonesia sudah sangat berkembang dalam bidang digital, kita punya dua decacorn, beberapa unicorn dan ribuan digital startup. Rumania juga punya talent digital yang bagus-bagus, yang barang kali bisa kita kerjasama yang kongkrit dalam bidang ekonomi digital,"" pungkas Johnny.";"Burduja berharap negaranya dapat belajar dari kisah sukses Indonesia dalam menciptakan unicorn, memfasilitasi ekosistem inovasi, memanfaatkan sumber daya manusia yang dimiliki negara. ""Kami berharap dapat berkontribusi dalam keamanan cyber. Sementara itu, Menkominfo menyampaikan rasa terima kasih dan penghargaan kepada pemerintah Rumania dalam mengatur konferensi ITU yang dinilainya sangat baik. Dalam pertemuan yang berlangsung kurang dari 30 menit, Menkominfo sempat memaparkan kebijakan tentang bagaimana Indonesia berupaya dalam ikut ambil bagian mengurangi kesenjangan digital, sehingga 2,7 miliar orang yang tidak terhubung makin berkurang. Rumania juga punya talent digital yang bagus-bagus, yang barang kali bisa kita kerjasama yang kongkrit dalam bidang ekonomi digital,"" pungkas Johnny.";https://inet.detik.com/telecommunication/d-6318097/rumania-pastikan-dukung-indonesia-di-dewan-telko-dunia
Sinergi & Kolaborasi, Kunci Menuju Kesuksesan Transformasi Digital RI;11 October 2022;0,37202;cyber security;Jakarta - Hidup penuh dengan dinamika yang tidak terduga. Di satu waktu kita berada di puncak, dan di waktu lain kita bisa saja mengalami titik terendah dalam hidup. Terlebih di masa pandemi COVID-19 seperti sekarang ini. Kita harus beradaptasi menghadapi bermacam-macam transisi yang tidak bisa diprediksi. Dalam pekerjaan misalnya, atasan marah lantaran hasil projek yang dikerjakan tidak sesuai ekspektasi. Atau pemutusan hubungan kerja (PHK) mendadak karena perusahaan terpaksa beradaptasi dengan situasi pandemi. Hal tersebut memang bisa membuat sebagian besar orang merasa stres dan kecewa. Kendati demikian, kita harus menguatkan tekad dan tetap move on dengan kehidupan, terutama demi orang-orang tersayang yang senantiasa menyambut kepulangan di rumah. Karena, dukungan kecil yang diberikan oleh istri, anak dan bahkan orang terdekat dapat menjadi kekuatan untuk bangkit dan menghadapi berbagai masalah yang datang silih berganti. Kerja sama dan kolaborasi itulah yang menjadi kunci untuk terus maju dan berkembang. Seperti halnya yang dilakukan Detik Network bersama dengan Huawei Cloud yang bersinergi mengemban tanggung jawab demi kemajuan digital di Indonesia. Salah satunya dengan menggelar Huawei Cloud Indonesia Summit 2022 pada 29 September lalu. Acara ini menghadirkan para pelaku bisnis dan pakar terbaik cloud technology yang mengupas tuntas kiat melakukan transformasi digital secara efisien. Tak hanya berbagi tips menerapkan transformasi digital yang efisien, Huawei Cloud juga hadir di Indonesia lewat data center pertamanya yang akan diresmikan pada November mendatang. Khusus untuk pasar Indonesia, Huawei Cloud terus berupaya untuk memberikan layanan cloud yang inovatif untuk merealisasikan komitmen mereka. Nantinya, data center yang akan diluncurkan tersebut berfokus pada strategi Everything as a service. Strategi ini mencakup sejumlah hal yang akan difokuskan, yakni Infrastructure as a Service (Infrastruktur sebagai Layanan), Technology as a Service (Teknologi sebagai Layanan), Expertise as a service (Keahlian sebagai layanan), dan kolaborasi yang saling menguntungkan. Huawei menjelaskan nantinya perusahaan teknologi ini akan berfokus untuk membantu pada pendalaman transformasi digital, akselerasi teknologi cloud native, inovasi bisnis, dan mengembangkan layanan B2B. Dengan begitu diharapkan mampu membantu menciptakan nilai tambah bagi para pelanggan. Para pelanggan Huawei Cloud yang ada di Indonesia dipastikan akan selalu mendapatkan pelayanan dengan kualitas terbaik. Untuk mewujudkan itu, Huawei akan terus menjaga konsistensi kolaborasi bersama mitra strategisnya. Sehingga dampak besarnya bisa memberikan efek positif terhadap pertumbuhan ekonomi digital Indonesia. Secara kinerja, Huawei Cloud mencatat ada penambahan pelanggan sebanyak 155% dan pertumbuhan mitra ekosistem sebanyak 91% di 2021 lalu. Dari pencapaian tersebut, para mitra sukses membukukan pemasukan hingga 150% lebih tinggi dari pemasukan Huawei Cloud. Di tahun 2022 ini, Huawei Cloud optimistis mampu menambah pertumbuhan penetrasi pasarnya di Indonesia hingga 2023. Sebab langkah yang dilakukan oleh Huawei tidak hanya merambah ke berbagai industri di Indonesia, tapi juga dapat membantu memperkuat referensi pasar sehingga menjadikan Huawei Cloud sebagai pilihan utama. Bergeser ke pasar global, Huawei Cloud telah masuk ke Asia Tenggara sejak 2018 lalu. Ketika itu, Huawei Cloud memilih Singapura, Thailand, dan Malaysia sebagai target pasarnya. Ekspansi ke pasar ASEAN tersebut pun bisa dikatakan menjadi berkah bagi Huawei. Pasalnya, 4 tahun berselang, Huawei sukses menjadi salah satu dari 5 penyedia cloud teratas di kawasan Asia Tenggara. Huawei Cloud menempati peringkat ketiga di Thailand, dan peringkat keempat di negara-negara berkembang di seluruh Asia Pasifik termasuk Indonesia. Secara global, Huawei Cloud telah beroperasi di 27 region di dunia. Huawei Cloud juga memiliki 65 Availability Zones (AZs) dan 2.800 node untuk content delivery network (CDN) di seluruh dunia. Melalui kerja sama dengan lebih dari 6.000 aplikasi mitra, Huawei melayani pelanggan dari berbagai industri di 170 negara, menyediakan lebih dari 220 layanan cloud serta lebih dari 210 solusi, dan berkontribusi terhadap transformasi digital dalam skala global. (adv/adv);Jakarta - Hidup penuh dengan dinamika yang tidak terduga. Di satu waktu kita berada di puncak, dan di waktu lain kita bisa saja mengalami titik terendah dalam hidup. Terlebih di masa pandemi COVID-19 seperti sekarang ini. Kita harus beradaptasi menghadapi bermacam-macam transisi yang tidak bisa diprediksi. Dalam pekerjaan misalnya, atasan marah lantaran hasil projek yang dikerjakan tidak sesuai ekspektasi.;https://news.detik.com/adv-nhl-detikcom/d-6342428/sinergi--kolaborasi-kunci-menuju-kesuksesan-transformasi-digital-ri
Perkembangan fintech bukan terletak pada teknologi namun kepercayaan ;10 October 2022;0,28388;cyber security;"JAKARTA - Otoritas Jasa Keuangan (OJK) menilai pertumbuhan ekosistem financial technology (fintech) harus diimbangi dengan peningkatan kepercayaan masyarakat terhadap industri keuangan digital. Deputi Komisioner OJK Institute dan Keuangan Digital Imansyah mengatakan, berdasarkan riset tahun 2021, hanya 37 persen koresponden yang mempercayai fintech. Angka tersebut jauh dari tingkat kepercayaan koresponden ke layanan perbankan yang mencapai 60 persen. Padahal menurutnya, apabila kepercayaan masyarakat terhadap layanan keuangan digital meningkat, maka minat masyarakat menggunakan layanan keuangan digital juga akan meningkat. Baca juga: Cek Rekening, BSU Tahap 5 Cair Hari Ini Untuk itu, dia bilang, saat ini upaya yang paling mendesak dilakukan untuk mengembangkan ekosistem fintech ialah dengan meningkatkan kepercayaan masyarakat terhadap layanan keuangan digital. ""Perkembangan fintech bukan terletak pada teknologi melainkan kepercayaan,"" ujarnya saat membuka acara OJK Virtual Innovation Day 2022 di Wisma Mulia 2, Jakarta, Senin (10/10/2022). Pasalnya, di era digitalisasi ini konsumen akan mempercayakan data pribadi dan asetnya ke penyedia layanan teknologi, sedangkan tidak semua konsumen memiliki literasi yang cukup terkait keamanan data pribadi. Di sisi lain jumlah platform digital terus bertambah dan beraneka ragam sehingga kemungkinan besar konsumen memberikan data pribadinya ke lebih dari satu platform digital. Imansyah mengatakan, faktor terpenting yang harus dimiliki penyedia fintech agar dapat meningkatkan kepercayaan masyarakat ialah menjamin keamanan data konsumen, produk dan jasa yang ditawarkan terjangkau, tidak menjual data konsumen, dan membantu konsumen mencapai tujuan keuangan. ""Untuk menjawab kepentingan konsumen ini, beberapa aspek penting untuk meningkatkan kepercayaan konsumen terhadap fintech melalui pasar yang akomodatif, regulasi yang akomodatif, sistem keamanan yang memadai, tingkat literasi konsumen yang memadai, dan yang pasti pengawasan afektif,"" tukasnya. ";JAKARTA - Otoritas Jasa Keuangan (OJK) menilai pertumbuhan ekosistem financial technology (fintech) harus diimbangi dengan peningkatan kepercayaan masyarakat terhadap industri keuangan digital. Angka tersebut jauh dari tingkat kepercayaan koresponden ke layanan perbankan yang mencapai 60 persen. Padahal menurutnya, apabila kepercayaan masyarakat terhadap layanan keuangan digital meningkat, maka minat masyarakat menggunakan layanan keuangan digital juga akan meningkat. Pasalnya, di era digitalisasi ini konsumen akan mempercayakan data pribadi dan asetnya ke penyedia layanan teknologi, sedangkan tidak semua konsumen memiliki literasi yang cukup terkait keamanan data pribadi. Imansyah mengatakan, faktor terpenting yang harus dimiliki penyedia fintech agar dapat meningkatkan kepercayaan masyarakat ialah menjamin keamanan data konsumen, produk dan jasa yang ditawarkan terjangkau, tidak menjual data konsumen, dan membantu konsumen mencapai tujuan keuangan.;https://money.kompas.com/read/2022/10/10/140500126/ojk-perkembangan-fintech-bukan-terletak-pada-teknologi-melainkan-kepercayaan
Tips keamanan cyber untuk pse;21 September 2022;1;cyber security;"Jakarta - Saat ini data sudah menjadi aset yang sangat bernilai. Maka tak heran banyak serangan cyber menyasar pada lembaga dan perusahaan Penyelenggara Sistem Elektronik (PS) Pakar keamanan cyber sekaligus Presiden Direktur ITSEC Asia, Andri Hutama Putra, mengatakan bahwa ancaman peningkatan kebocoran data ini perlu diwaspadai oleh para PSE, terutama untuk lembaga atau perusahaan yang menyimpan data pribadi masyarakat. ""Serangan siber dan kebocoran data dapat berdampak luas mulai dari kerugian operasional atau finansial dari PSE itu sendiri, dan juga potensi kejahatan digital bagi pengguna yang terdampak dari kebocoran data pribadi mereka,"" jelas Andri. Menurutnya lembaga atau perusahaan PSE perlu membekali diri dengan infrastruktur keamanan siber untuk memproteksi dari ancaman serangan. Mulai dari membentuk tim keamanan cyber atau bermitra dengan penyedia layanan keamanan siber, dan juga menerapkan berbagai SOP dan langkah perlindungan pada jaringan dan aplikasi yang ada. Selain itu perlu adanya IT Security Roadmap yang jelas, terarah, dan berkomitmen yang meliputi people, process, dan technology. IT Security Roadmap dapat menjadi panduan dari manajemen untuk meningkatkan security maturity level dan literasi keamanan digital secara internal.";"Jakarta - Saat ini data sudah menjadi aset yang sangat bernilai. Maka tak heran banyak serangan cyber menyasar pada lembaga dan perusahaan Penyelenggara Sistem Elektronik (PS) Pakar keamanan cyber sekaligus Presiden Direktur ITSEC Asia, Andri Hutama Putra, mengatakan bahwa ancaman peningkatan kebocoran data ini perlu diwaspadai oleh para PSE, terutama untuk lembaga atau perusahaan yang menyimpan data pribadi masyarakat. ""Serangan siber dan kebocoran data dapat berdampak luas mulai dari kerugian operasional atau finansial dari PSE itu sendiri, dan juga potensi kejahatan digital bagi pengguna yang terdampak dari kebocoran data pribadi mereka,"" jelas Andri. Menurutnya lembaga atau perusahaan PSE perlu membekali diri dengan infrastruktur keamanan siber untuk memproteksi dari ancaman serangan. Mulai dari membentuk tim keamanan cyber atau bermitra dengan penyedia layanan keamanan siber, dan juga menerapkan berbagai SOP dan langkah perlindungan pada jaringan dan aplikasi yang ada. Selain itu perlu adanya IT Security Roadmap yang jelas, terarah, dan berkomitmen yang meliputi people, process, dan technology. IT Security Roadmap dapat menjadi panduan dari manajemen untuk meningkatkan security maturity level dan literasi keamanan digital secara internal.";https://inet.detik.com/tips-dan-trik/d-6303187/tips-keamanan-cyber-untuk-pse-biar-tak-dibobol-bjorka-cs
Aktivis India Kecam Bill Gates: Dia Tidak Ciptakan Apa-apa;15 October 2022;0,62318;cyber security;"Jakarta - Vandana Shiva, seorang aktivis lingkungan dari India, tiba-tiba viral di TikTok lewat videonya yang berisi kritikan keras terhadap Bill Gates. Dalam video itu, Shiva mengomentari kontribusi Gates di Microsoft sampai kegiatan amalnya. Video yang diunggah oleh akun @vandanashivamovie itu memperlihatkan Shiva yang sedang diwawancarai di program Democracy Now. Video itu sudah ditonton lebih dari 4,7 juta kali dan mendapatkan lebih dari 270 ribu likes. Dalam video tersebut, Shiva ditanya pendapatnya tentang bagaimana Bill Gates bisa berpengaruh seperti sekarang. Shiva menjawab Bill Gates bisa berkuasa seperti sekarang bukan karena ia dulunya merupakan kreator yang ulung. ""Bill Gates tidak menciptakan apa-apa. Program BASIC dibuat oleh beberapa dosen matematika di universitas,"" kata Shiva dalam cuplikan video tersebut. ""Sistem operasi Office diciptakan oleh software engineer yang ia beli seharga USD 50.000. Ia menciptakan kerjaan dengan membuat paten untuk software,"" sambungnya. Shiva menambahkan, setelah Gates jadi kaya raya ia menggunakan pengaruhnya untuk menggantikan transaksi konvensional dengan pembayaran digital, yang ujung-ujungnya akan semakin memperkaya pendiri Microsoft itu. ""Dia jadi satu-satunya mendapat keuntungan karena semua software, untuk semua ekoonomi digital, dia mengumpulkan uang sewa dan royalti dari situ,"" ujar Shiva. Shiva menambahkan, setelah Gates jadi kaya raya ia menggunakan pengaruhnya untuk menggantikan transaksi konvensional dengan pembayaran digital, yang ujung-ujungnya akan semakin memperkaya pendiri Microsoft itu. ""Dia jadi satu-satunya mendapat keuntungan karena semua software, untuk semua ekoonomi digital, dia mengumpulkan uang sewa dan royalti dari situ,"" ujar Shiva. Di akhir videonya, Shiva kemudian mengomentari Gates yang beralih ke dunia filantropi setelah pensiun dari Microsoft. Meski banyak dipuji publik setelah menyumbangkan miliaran dolar lewat Bill and Melinda Gates Foundation, Shiva mengatakan Bill Gates punya tujuannya sendiri di balik donasi tersebut. ""Saya memiliki analisis di buku. Semua tempat yang ia beri sumbangan adalah pasar baginya di masa depan,"" pungkasnya.";Jakarta - Vandana Shiva, seorang aktivis lingkungan dari India, tiba-tiba viral di TikTok lewat videonya yang berisi kritikan keras terhadap Bill Gates. Dalam video itu, Shiva mengomentari kontribusi Gates di Microsoft sampai kegiatan amalnya. Video yang diunggah oleh akun @vandanashivamovie itu memperlihatkan Shiva yang sedang diwawancarai di program Democracy Now. Video itu sudah ditonton lebih dari 4,7 juta kali dan mendapatkan lebih dari 270 ribu likes. Dalam video tersebut, Shiva ditanya pendapatnya tentang bagaimana Bill Gates bisa berpengaruh seperti sekarang.;https://inet.detik.com/cyberlife/d-6349701/aktivis-india-kecam-bill-gates-dia-tidak-ciptakan-apa-apa
