Judul;Date;cosine;Kategori;Artikel;Summary;Link
Lokasi pengguna WA rentan dilacak hacker;24 October 2022;0,78458;hacking;"Jakarta- WhatsApp dan Signal merupakan dua aplikasi messenger yang menjagokan keamanannya. Tapi peneliti keamanan menemukan metode untuk mengekspos data lokasi pengguna WhatsApp dan Signal. Metode ini ditemukan oleh peneliti dari kelompok advokasi privasi digital RestorePrivacy. Mereka menemukan celah keamanan yang bisa dieksploitasi oleh hacker untuk melacak lokasi pengguna WhatsApp, Signal, dan Threema dengan akurasi hingga 80%. Hacker atau orang dengan niat jahat bisa mengandalkan 'timing attack' untuk menentukan lokasi pengguna dengan menghitung waktu yang dibutuhkan sampai pesan itu diterima oleh target. Timing ini akan mengindikasikan jarak yang ditempuh oleh pesan tersebut. ""Karena jaringan internet mobile dan infrastruktur server aplikasi IM memiliki karakteristik fisik tertentu yang menghasilkan jalur sinyal standar, notifikasi ini memiliki delay yang dapat diprediksi berdasarkan posisi pengguna,"" tulis RestorePrivacy dalam laporannya, seperti dikutip dari 9to5Mac, Senin (24/10/2022). Hacker bisa menghitung delay untuk menentukan negara, kota, hingga distrik tempat penerima pesan. Bahkan hacker juga bisa mengetahui apakah targetnya menggunakan WiFi atau internet mobile. Serangan ini memiliki penerapan yang sangat terbatas, jadi hanya bisa digunakan oleh target yang sudah dikenali dan sudah bercakap-cakap lewat WhatsApp, Signal, atau Threema sebelumnya. Tapi hacker bisa mengulangi serangan ini berkali-kali untuk mendapatkan lokasi yang lebih akurat. Bahkan hacker bisa mengumpulkan dataset untuk menentukan berbagai lokasi yang sering dikunjungi pengguna, termasuk rumah, kantor, hingga gym. Berdasarkan eksperimen RestorePrivacy, tingkat akurasi deteksi untuk masing-masing aplikasi messenger adalah 82% untuk Signal, 80% untuk Threema, dan 74% untuk WhatsApp. Laporan ini mengindikasikan baik pengguna Android maupun iOS sama-sama rentan terhadap serangan ini. Untuk mengatasi serangan ini, RestorePrivacy menyarankan penyedia aplikasi messenger untuk menggunakan waktu konfirmasi pengiriman pesan yang acak. RestorePrivacy mengatakan dua dari tiga aplikasi ini sudah menyelidiki masalah tersebut, tapi namanya tidak disebut secara spesifik. ""Apapun dari 1 hingga 20 detik akan cukup untuk membuat timing attack ini tidak bisa dilakukan tanpa merusak fungsi notifikasi status pengiriman,"" kata RestorePrivacy. Selain itu, pengguna juga disarankan mengaktifkan VPN untuk meningkatkan latensi atau delay. Pengguna yang khawatir juga bisa menonaktifkan fitur notifikasi pengiriman pesan jika didukung oleh aplikasi messenger yang digunakan.";"Tapi peneliti keamanan menemukan metode untuk mengekspos data lokasi pengguna WhatsApp dan Signal. Hacker atau orang dengan niat jahat bisa mengandalkan 'timing attack' untuk menentukan lokasi pengguna dengan menghitung waktu yang dibutuhkan sampai pesan itu diterima oleh target. Untuk mengatasi serangan ini, RestorePrivacy menyarankan penyedia aplikasi messenger untuk menggunakan waktu konfirmasi pengiriman pesan yang acak. ""Apapun dari 1 hingga 20 detik akan cukup untuk membuat timing attack ini tidak bisa dilakukan tanpa merusak fungsi notifikasi status pengiriman,"" kata RestorePrivacy. Pengguna yang khawatir juga bisa menonaktifkan fitur notifikasi pengiriman pesan jika didukung oleh aplikasi messenger yang digunakan.";https://inet.detik.com/security/d-6365538/duh-lokasi-pengguna-whatsapp-rentan-dilacak-hacker
Polisi Bongkar Jaringan Peretas Mobil Bersistem Keyless;20 October 2022;0,8537;hacking;"Polisi dari Prancis, Latvia, dan Spanyol belum lama ini menangkap 31 tersangka yang diyakini sebagai jaringan pencurian mobil yang menargetkan kendaraan dari dua produsen mobil Prancis. Para penjahat hanya menargetkan mobil yang menggunakan sistem keyless entry dan start, lalu mencurinya setelah mengeksploitasi teknologi keyless untuk membuka kunci pintu dan menyalakan mesin tanpa harus menggunakan key fobs. Untuk melakukan aksinya, mereka menggunakan alat fraudulent yang dijual secara online sebagai solusi diagnostik otomotif untuk menggantikan perangkat lunak mobil curian dan melewati sistem keyless kendaraan untuk masuk dan mencurinya. Komando dunia maya dari French National Gendarmerie (FNG) juga menyita domain perangkat lunak penipuan yang digunakan para peretas untuk menembus teknologi keyless pada mobil. Namun, sebagaimana dikutip dari Bleeping Computer, Kamis (20/10/2022), siaran pers Europol tidak menyebutkan URL situs web atau domain tempat situs tersebut di-hosting. ""Sebagai hasil dari tindakan terkoordinasi yang dilakukan pada 10 Oktober di tiga negara yang terlibat, 31 tersangka ditangkap. Sebanyak 22 lokasi digeledah, dan lebih dari EUR 1.098.500 aset kriminal disita,"" kata Europol. ""Di antara mereka yang ditangkap adalah pengembang perangkat lunak, pengecernya, dan pencuri mobil yang menggunakan alat ini untuk mencuri kendaraan,"" sambungnya. Sayangnya, Europol tidak menjelaskan bagaimana serangan itu bisa berhasil meretas kendaraan bersistem keyless, di mana sistem entri tanpa kunci jarak jauh (remote keyless entry/RKE) rentan terhadap berbagai kejahatan.";"Para penjahat hanya menargetkan mobil yang menggunakan sistem keyless entry dan start, lalu mencurinya setelah mengeksploitasi teknologi keyless untuk membuka kunci pintu dan menyalakan mesin tanpa harus menggunakan key fobs. Untuk melakukan aksinya, mereka menggunakan alat fraudulent yang dijual secara online sebagai solusi diagnostik otomotif untuk menggantikan perangkat lunak mobil curian dan melewati sistem keyless kendaraan untuk masuk dan mencurinya. Komando dunia maya dari French National Gendarmerie (FNG) juga menyita domain perangkat lunak penipuan yang digunakan para peretas untuk menembus teknologi keyless pada mobil. ""Sebagai hasil dari tindakan terkoordinasi yang dilakukan pada 10 Oktober di tiga negara yang terlibat, 31 tersangka ditangkap. Sayangnya, Europol tidak menjelaskan bagaimana serangan itu bisa berhasil meretas kendaraan bersistem keyless, di mana sistem entri tanpa kunci jarak jauh (remote keyless entry/RKE) rentan terhadap berbagai kejahatan.";https://m.liputan6.com/tekno/read/5101785/polisi-bongkar-jaringan-peretas-mobil-bersistem-keyless
Tragedi keamanan siber dan data pribadi;29 September 2022;0,64724;identifity thief;DALAM tradisi Yunani klasik, tragedi merupakan perayaan teatrikal warga Athena yang menampilkan cerita-cerita para dewa dan penguasa dengan akhir yang tragis. Aristoteles menyebut tragedi penting bagi masyarakat Athena sebagai katarsis - membangkitkan sensasi ngeri dan sedih, dan pada akhirnya, memberi pelajaran kehidupan bagi pemirsanya. Para aktor lakon tragedi didominasi laki-laki dan, dalam bahasa Yunani, disebut sebagai hypocrites. Peretasan dan pemerintah yang kelabakan Rasa-rasanya, kesemua unsur dalam lakon tragedi Yunani kuno hadir di hadapan publik Indonesia secara banal belakangan ini. Tragedi itu bernama keamanan siber dan data pribadi kita yang hancur lebur dikoyak peretas-peretas (hacker) anonim. Baca juga: Penyelesaian Sengketa dalam UU Perlindungan Data Pribadi Hal itu diikuti rangkaian reaksi dari pemerintah Indonesia yang kelabakan, khususnya jajaran Kementerian Komunikasi dan Informasi (Kemenkominfo) dan Badan Siber dan Sandi Negara (BSSN). Selain saling lempar tanggung jawab, rentetan respons dan statemen yang ditampilkan sejumlah pejabat juga membuat publik semakin miris. Pada minggu ini peretasan terhadap sejumlah jurnalis menjadi tema utama. Bocornya data penduduk Indonesia sebenarnya bukan hal baru, mengingat tahun lalu Nomor Induk Kependudukan (NIK) Presiden Joko Widodo bocor di sejumlah forum internet. Bagi masyarakat umum, peristiwa-peristiwa itu berkesinambungan dengan kontroversi terkait aturan Penyelenggara Sistem Elektronik (PSE) dan rencana penggunaan Domain Names System (DNS) nasional yang dianggap berpotensi membatasi kemerdekaan berekspresi dan demokrasi. Kasus hacker yang menyebut dirinya Bjorka menjadi titik didih kemarahan publik terhadap pemangku kepentingan di bidang komunikasi, informasi, dan keamanan siber. Hingga pada akhirnya Presiden Joko Widodo menyentil jajaran Kemenkominfo dan BSSN. Setelah itu  pemerintah baru memutuskan untuk membentuk tim khusus buat memburu Bjorka. Setelah itu, Rancangan Undang-Undang (RUU) Perlindungan Data Pribadi mendapat booster politik dan proses legislasinya selesai di DPR. Namun, kasus peretasan terhadap jurnalis Narasi kembali membuat publik bertanya-tanya tentang keamanan siber di negeri ini. Bagaimana negara ini memperlakukan keamanan siber dan data pribadi? Pertanyaan yang lebih dalam, keamanan siber untuk siapa? Bisa jadi momentum untuk berbenah Bagi saya, terlepas dari segala kontroversinya, rentetan peristiwa itu sebenarnya merupakan kabar baik bagi keamanan siber di Indonesia. Untuk pertama kalinya, pemerintah dan masyarakat memberi perhatian sangat serius terhadap isu keamanan siber dan perlindungan data pribadi. Meskipun, eskalasi ini harus menunggu para pejabat dan lembaga penting negara diserang dulu oleh Bjorka dan peretas-peretas lain. Selama ini, masyarakat yang lebih sering menjadi korban serangan siber dengan berbagai macam bentuk. Kita bisa bertanya kepada mahasiswa-mahasiswi atau para aktivis lingkungan yang pernah menjadi korban peretasan Whatsapp dan data pribadinya lalu diumbar di internet. Kita juga bisa bertanya kepada para bapak-bapak dan ibu-ibu yang tertekan akibat teror penagih pinjaman online karena data pribadinya bocor. Baca juga: Tafsir UU Perlindungan Data Pribadi yang Perlu Diketahui Demikian juga dengan para jurnalis, tidak hanya dalam kasus jurnalis Narasi, tetapi di daerah-daerah, doxing dan peretasan WhatsApp serta surat elektronik menjadi fenomena rutin, sebagaimana disebut SAFENet. Selama ini para korban serangan siber hanya pasrah data pribadinya diumbar atau dipakai oleh para buzzer dan tukang tagih pinjaman online. Selain tak ada payung hukum yang kuat mengingat lamanya proses legislasi RUU Perlindungan Data Pribadi selama ini, upaya atribusi terhadap pelaku kejahatan dan penyerangan siber juga sulit dilakukan. Kini, yang selama ini dialami para korban serangan siber dialami pula oleh pemerintah. Mulai dari kebingungan hingga kesulitan mengidentifikasi siapa sebenarnya Bjorka, atau siapa peretas para jurnalis. Lebih parah lagi, kita tak pernah benar-benar mengembangkan budaya keamanan siber dan perlindungan data pribadi secara menyeluruh, secara nasional. Ini perlu menjadi momentum penting untuk memikirkan kembali bagaimana kita memahami keamanan siber dan data pribadi. Persoalan keamanan siber dan data pribadi seyogyanya tak dipahami sebagai isu keamanan tradisional yang muara utamanya adalah tentang keamanan negara. Siapapun bisa menjadi korban, baik pejabat, aparat, jurnalis, maupun rakyat. Dalam tradisi kajian keamanan internasional, keamanan siber dipandang sebagai bagian dari keamanan non-tradisional yang meletakkan tidak hanya negara sebagai obyek yang harus dilindungi ketika berbicara mengenai keamanan dan pertahanan. Sifat ruang siber yang difusif dan transnasional membuat ancaman siber dapat menimpa siapa saja. Keamanan siber wajib pula meliputi individu, kelompok masyarakat, dan bahkan nilai dan norma dari suatu negara - semuanya perlu dipandang setara alih-alih negara atau pejabat dilindungi lebih tinggi prioritas keamanan sibernya ketimbang rakyat biasa. Hal ini yang disebut Myriam Dunn Cavelty (2014) tentang bahaya diskursus keamanan siber jika hanya berfokus tunggal pada negara. Jika itu terjadi, negara akan melakukan penguatan keamanan siber dengan mengorbankan keamanan individual. Negara berpotensi akan memprioritaskan pengamanan untuk aparatus dan instrumen kekuasaan alih-alih rakyatnya. Negara, pada akhirnya, dapat menjadi ancaman keamanan siber itu sendiri terhadap warga negaranya. Konsekuensinya, dengan paradigma itu, fokus dan prioritas keamanan dan pengamanan siber menjadi seakan berhenti ketika UU PDP selesai, atau ketika kita tidak mendengar lagi Whatsapp pejabat diretas. Ini tentu saja berbahaya mengingat keamanan siber bukan hanya keamanan negara, tetapi juga keamanan bagi semua. Perlindungan terhadap masyarakat sipil, jurnalis, hingga para mahasiswa yang kritis perlu menjadi perhatian. Penegakan hukum terhadap pelaku kejahatan siber seharusnya tak hanya menunggu apabila pemerintah dan negara menjadi target. Bahkan, apabila serangan siber terjadi pada mereka yang kritis terhadap pemerintah, aparat penegak hukum dan negara tetap perlu memberi perhatian dan perlindungan yang sama. Sebab, pemerintah dapat berganti setiap pemilu lima tahunan, tetapi ancaman keamanan siber tak pernah melihat siapa korban. Semua bisa kena.;DALAM tradisi Yunani klasik, tragedi merupakan perayaan teatrikal warga Athena yang menampilkan cerita-cerita para dewa dan penguasa dengan akhir yang tragis. Peretasan dan pemerintah yang kelabakan Rasa-rasanya, kesemua unsur dalam lakon tragedi Yunani kuno hadir di hadapan publik Indonesia secara banal belakangan ini. Tragedi itu bernama keamanan siber dan data pribadi kita yang hancur lebur dikoyak peretas-peretas (hacker) anonim. Selama ini para korban serangan siber hanya pasrah data pribadinya diumbar atau dipakai oleh para buzzer dan tukang tagih pinjaman online. Selain tak ada payung hukum yang kuat mengingat lamanya proses legislasi RUU Perlindungan Data Pribadi selama ini, upaya atribusi terhadap pelaku kejahatan dan penyerangan siber juga sulit dilakukan.;https://www.kompas.com/tren/read/2022/09/29/111707365/tragedi-keamanan-siber-dan-data-pribadi?page=all
Awas google translate palsu bisa curi data kita;18 October 2022;0,7705;identifity thief;Jakarta- Peneliti keamanan di Avanan menemukan aksi pencurian data dengan teknik phishing yang memanfaatkan 'Google Translate' tiruan. Temuan ini diawali dari deretan email phishing berbahasa Spanyol yang ditemukan oleh para peneliti keamanan Siber di Avanan. Seperti email phishing pada umumnya, pengirim email mengaku berasal dari penyedia layanan email yang dipakai calon korban. Calon korbannya ini ditakut-takuti dengan disebut kalau identitasnya belum terkonfirmasi, dan mereka bisa kehilangan akses ke email yang belum terbaca jika tak segera bertindak, yaitu mengkonfirmasi identitasnya. Peneliti keamanan di Avanan pun melihat email ini menggunakan taktik standar dalam aksi phishing, yaitu menyusupkan tautan ke situs tiruan, dalam hal ini Google Translate, untuk mencuri data korbannya. Tautan ke Google Translate palsu itu jika diklik akan mengarahkan calon korban ke situs yang menyerupai laman penerjemah buatan Google tersebut. Namun bedanya, di bagian atas laman ada kotak yang muncul dan meminta calon korban untuk memasukkan user ID dan password-nya. Tentu jika ada yang tertipu dan memasukkan data tersebut ke dalam boks, user ID dan password itu tak akan masuk ke server Google, melainkan masuk ke dalam server milik si pelaku. Menariknya, situs Google Translate tiruan ini terlihat sangat otentik. Menurut peneliti Avanan, si pelaku menggunakan banyak kode Javascript untuk membuat situs tersebut terlihat asli. Bahkan mereka juga menggunakan perintah Unescape untuk menyembunyikan tujuan utama mereka, demikian dikutip detikINET dari Techradar, Selasa (18/10/2022). Mereka pun menyebut kalau pelaku menggunakan bermacam trik dari taktik phishing untuk bisa meyakinkan calon korban. Misalnya ada aspek rekayasa sosial pada bagian awal, lalu meniru situs populer untuk mencuri data, dan memakai obfuscation untuk menipu layanan keamanan. Tentunya, Google Translate yang asli tak meminta pengguna login untuk bisa menggunakan layanannya.;Jakarta- Peneliti keamanan di Avanan menemukan aksi pencurian data dengan teknik phishing yang memanfaatkan 'Google Translate' tiruan. Temuan ini diawali dari deretan email phishing berbahasa Spanyol yang ditemukan oleh para peneliti keamanan Siber di Avanan. Tautan ke Google Translate palsu itu jika diklik akan mengarahkan calon korban ke situs yang menyerupai laman penerjemah buatan Google tersebut. Namun bedanya, di bagian atas laman ada kotak yang muncul dan meminta calon korban untuk memasukkan user ID dan password-nya. Mereka pun menyebut kalau pelaku menggunakan bermacam trik dari taktik phishing untuk bisa meyakinkan calon korban.;https://inet.detik.com/security/d-6355821/awas-ada-google-translate-palsu-bisa-curi-data
Lokasi pengguna WA rentan dilacak hacker;24 October 2022;0,78458;identifity thief;"Jakarta- WhatsApp dan Signal merupakan dua aplikasi messenger yang menjagokan keamanannya. Tapi peneliti keamanan menemukan metode untuk mengekspos data lokasi pengguna WhatsApp dan Signal. Metode ini ditemukan oleh peneliti dari kelompok advokasi privasi digital RestorePrivacy. Mereka menemukan celah keamanan yang bisa dieksploitasi oleh hacker untuk melacak lokasi pengguna WhatsApp, Signal, dan Threema dengan akurasi hingga 80%. Hacker atau orang dengan niat jahat bisa mengandalkan 'timing attack' untuk menentukan lokasi pengguna dengan menghitung waktu yang dibutuhkan sampai pesan itu diterima oleh target. Timing ini akan mengindikasikan jarak yang ditempuh oleh pesan tersebut. ""Karena jaringan internet mobile dan infrastruktur server aplikasi IM memiliki karakteristik fisik tertentu yang menghasilkan jalur sinyal standar, notifikasi ini memiliki delay yang dapat diprediksi berdasarkan posisi pengguna,"" tulis RestorePrivacy dalam laporannya, seperti dikutip dari 9to5Mac, Senin (24/10/2022). Hacker bisa menghitung delay untuk menentukan negara, kota, hingga distrik tempat penerima pesan. Bahkan hacker juga bisa mengetahui apakah targetnya menggunakan WiFi atau internet mobile. Serangan ini memiliki penerapan yang sangat terbatas, jadi hanya bisa digunakan oleh target yang sudah dikenali dan sudah bercakap-cakap lewat WhatsApp, Signal, atau Threema sebelumnya. Tapi hacker bisa mengulangi serangan ini berkali-kali untuk mendapatkan lokasi yang lebih akurat. Bahkan hacker bisa mengumpulkan dataset untuk menentukan berbagai lokasi yang sering dikunjungi pengguna, termasuk rumah, kantor, hingga gym. Berdasarkan eksperimen RestorePrivacy, tingkat akurasi deteksi untuk masing-masing aplikasi messenger adalah 82% untuk Signal, 80% untuk Threema, dan 74% untuk WhatsApp. Laporan ini mengindikasikan baik pengguna Android maupun iOS sama-sama rentan terhadap serangan ini. Untuk mengatasi serangan ini, RestorePrivacy menyarankan penyedia aplikasi messenger untuk menggunakan waktu konfirmasi pengiriman pesan yang acak. RestorePrivacy mengatakan dua dari tiga aplikasi ini sudah menyelidiki masalah tersebut, tapi namanya tidak disebut secara spesifik. ""Apapun dari 1 hingga 20 detik akan cukup untuk membuat timing attack ini tidak bisa dilakukan tanpa merusak fungsi notifikasi status pengiriman,"" kata RestorePrivacy. Selain itu, pengguna juga disarankan mengaktifkan VPN untuk meningkatkan latensi atau delay. Pengguna yang khawatir juga bisa menonaktifkan fitur notifikasi pengiriman pesan jika didukung oleh aplikasi messenger yang digunakan.";"Tapi peneliti keamanan menemukan metode untuk mengekspos data lokasi pengguna WhatsApp dan Signal. Hacker atau orang dengan niat jahat bisa mengandalkan 'timing attack' untuk menentukan lokasi pengguna dengan menghitung waktu yang dibutuhkan sampai pesan itu diterima oleh target. Untuk mengatasi serangan ini, RestorePrivacy menyarankan penyedia aplikasi messenger untuk menggunakan waktu konfirmasi pengiriman pesan yang acak. ""Apapun dari 1 hingga 20 detik akan cukup untuk membuat timing attack ini tidak bisa dilakukan tanpa merusak fungsi notifikasi status pengiriman,"" kata RestorePrivacy. Pengguna yang khawatir juga bisa menonaktifkan fitur notifikasi pengiriman pesan jika didukung oleh aplikasi messenger yang digunakan.";https://inet.detik.com/security/d-6365538/duh-lokasi-pengguna-whatsapp-rentan-dilacak-hacker
Google Ngaku Pernah di Bobol Hacker;25 October 2022;0,34848;malware;"Jakarta - Siapa saja bisa jadi target serangan siber saat ini. Bahkan perusahaan sebesar Google juga pernah menjadi target serangan siber kelas kakap. Director of Government Affairs & Public Policy Google Indonesia Putri Alam mengatakan Google menjadi korban serangan siber setiap harinya. Beberapa tahun yang lalu, Google bahkan mengalami serangan siber fatal yang membuat mereka mengubah pendekatannya terhadap keamanan siber. Serangan siber itu merupakan salah satu kisah yang diangkat dalam serial dokumenter 'Hacking Google'. Putri mengatakan lewat serial ini Google ingin membagikan pembelajaran yang didapat dari pengalaman tersebut. ""Kami berharap upaya kami untuk berbagi pengalaman-pengalaman seperti ini dan juga transparan tentang ancaman dunia maya yang kami hadapi dapat menciptakan lebih banyak kepercayaan publik, meningkatkan kesadaran pengguna akan lanskap keamanan,"" kata Putri dalam acara nonton bareng 'Hacking Google' di Jakarta, Selasa (25/10/2022). Insiden itu terjadi pada tahun 2009, tidak lama setelah Google meluncurkan versi stabil sistem operasi Android. Pada 14 Desember 2009, VP of Security Engineering Google Heather Adkins dan timnya menemukan aktivitas tidak biasa berupa pesan yang dikirimkan kepada seorang karyawan. Pesan itu berisi link yang jika diklik akan mengarahkan korban ke situs yang mengunduh software berbahaya. Berkat malware ini, hacker berhasil menyusup ke jaringan Google dan mencuri kekayaan intelektual perusahaan. Serangan siber ini sempat membuat tim keamanan Google kebingungan karena serangan itu bisa mengubah taktik dengan sangat cepat. Akibatnya, tim keamanan Google memfokuskan kerjanya untuk satu masalah ini. Saking parahnya, tim keamanan Google sampai mengambil alih satu gedung kampus di markas mereka di Mountain View. Seluruh pakar keamanan Google juga berkumpul di Mountain View dan mengumpulkan semua hard drive yang ada di kampus untuk melakukan forensik. Saat menyelidiki sumber serangan ini, Google menemukan kode 'Aurora' di dalam kode berbahaya. Penemuan ini mendorong Google untuk memulai Operation Aurora dan mengubah cara mereka menangani masalah keamanan siber. Tim keamanan Google kemudian berhasil menendang hacker dari jaringannya setelah mengeluarkan semua perangkat karyawan dari jaringan dan mereset password. Pada tahun 2010, Google mengungkap serangan siber ini juga menargetkan 20 perusahaan lain dan dalang di balik serangan ini adalah pemerintah China. Setelah serangan siber tersebut, Google langsung mendirikan beberapa divisi khusus untuk menangani keamanan siber. Ada Threat Analysis Group yang bertugas memburu penjahat siber dan mengenali tekniknya. Ada juga Red Team, tim hacker yang bertugas menyerang produk-produk Google untuk menemukan celah di sistem keamanan perusahaan. Tim ini meniru strategi dan motif berbagai aktor jahat, mulai dari hacktivis sampai hacker yang dibekingi pemerintah.";Pada 14 Desember 2009, VP of Security Engineering Google Heather Adkins dan timnya menemukan aktivitas tidak biasa berupa pesan yang dikirimkan kepada seorang karyawan. Berkat malware ini, hacker berhasil menyusup ke jaringan Google dan mencuri kekayaan intelektual perusahaan. Tim keamanan Google kemudian berhasil menendang hacker dari jaringannya setelah mengeluarkan semua perangkat karyawan dari jaringan dan mereset password. Ada juga Red Team, tim hacker yang bertugas menyerang produk-produk Google untuk menemukan celah di sistem keamanan perusahaan. Tim ini meniru strategi dan motif berbagai aktor jahat, mulai dari hacktivis sampai hacker yang dibekingi pemerintah.;https://inet.detik.com/security/d-6368828/google-ngaku-pernah-dibobol-hacker-begini-kisahnya
